House,Price,Ubication,Features,Total_Area_m^2,Built_Area_m^2,Bedrooms,Bathrooms,Parking,Property_for_sale,Age,Rooms,Storage,Number_of_floors,Type_of_house,Orientation,Maintenance,columnA,columnB,columnC
"Oportunidad Casa En Condominio , Jurica, Querétaro",5400000,"Avenida Palma Cocotera, Palmares, Querétaro, QuerétaroVer información de la zona","['Superficie total310 m²', 'Superficie construida260 m²', 'Recámaras3', 'Baños3', 'Estacionamientos2', 'Es propiedad en remateNo', 'Antigüedad28 años', 'Ambientes6', 'Bodegas0', 'Mantenimiento3,000 MXN']",['Superficie total310 m²', 'Superficie construida260 m²', 'Recámaras3', 'Baños3', 'Estacionamientos2', 'Es propiedad en remateNo', 'Antigüedad28 años', 'Ambientes6', 'Bodegas0', 'Mantenimiento3,000 MXN'],,,,,
Venta Casa Centro Historico,8000000,"Ex-hacienda El Tintero, Ex-Hacienda El Tintero, Querétaro, QuerétaroVer información de la zona","['Superficie total170 m²', 'Superficie construida237 m²', 'Recámaras2', 'Baños2', 'Estacionamientos0', 'Es propiedad en remateNo', 'Antigüedad0 años', 'Ambientes5', 'Bodegas0', 'Cantidad de pisos0', 'Tipo de casaCasa', 'OrientaciónNorte', 'Mantenimiento0 MXN']",['Superficie total170 m²', 'Superficie construida237 m²', 'Recámaras2', 'Baños2', 'Estacionamientos0', 'Es propiedad en remateNo', 'Antigüedad0 años', 'Ambientes5', 'Bodegas0', 'Cantidad de pisos0', 'Tipo de casaCasa', 'OrientaciónNorte', 'Mantenimiento0 MXN'],,,
Casa Seminueva Con Excelente Ubicación Arf,750000,"Av Bellavista 2061, 76134 Santiago De Querétaro, Qro., Mexico, Rancho Bellavista, Querétaro, QuerétaroVer información de la zona","['Superficie total195 m²', 'Superficie construida195 m²', 'Recámaras3', 'Baños2', 'Estacionamientos1', 'Es propiedad en remateSí', 'Antigüedad5 años', 'Ambientes11', 'Bodegas0', 'Cantidad de pisos2', 'Tipo de casaCasa', 'OrientaciónNorte', 'Mantenimiento1 MXN']",['Superficie total195 m²', 'Superficie construida195 m²', 'Recámaras3', 'Baños2', 'Estacionamientos1', 'Es propiedad en remateSí', 'Antigüedad5 años', 'Ambientes11', 'Bodegas0', 'Cantidad de pisos2', 'Tipo de casaCasa', 'OrientaciónNorte', 'Mantenimiento1 MXN'],,,
"Casa De Recuperación Bancaria Adjudicada, En Avenida Bellavista, Rancho Bellavista, Querétaro. ¡no Créditos!",550000,"Av. Marqués De Tenerife 742, Real del Marques Residencial, Querétaro, QuerétaroVer información de la zona","['Superficie total126 m²', 'Superficie construida119 m²', 'Recámaras3', 'Baños2', 'Estacionamientos1', 'Es propiedad en remateSí', 'Antigüedad2,000 años', 'Ambientes8', 'Bodegas0', 'Cantidad de pisos2', 'Tipo de casaCasa', 'OrientaciónNorte', 'Mantenimiento1 MXN']",['Superficie total126 m²', 'Superficie construida119 m²', 'Recámaras3', 'Baños2', 'Estacionamientos1', 'Es propiedad en remateSí', 'Antigüedad2,000 años', 'Ambientes8', 'Bodegas0', 'Cantidad de pisos2', 'Tipo de casaCasa', 'OrientaciónNorte', 'Mantenimiento1 MXN'],,
Casa Venta Juriquilla Queretaro,610000,"Senda De La Aurora, Ángeles, Querétaro, QuerétaroVer información de la zona","['Superficie total98 m²', 'Superficie construida67 m²', 'Recámaras2', 'Baños1', 'Estacionamientos1', 'Es propiedad en remateSí', 'Antigüedad15 años', 'Ambientes6', 'Bodegas0', 'Cantidad de pisos2', 'Tipo de casaCasa', 'OrientaciónSur', 'Mantenimiento250 MXN']",['Superficie total98 m²', 'Superficie construida67 m²', 'Recámaras2', 'Baños1', 'Estacionamientos1', 'Es propiedad en remateSí', 'Antigüedad15 años', 'Ambientes6', 'Bodegas0', 'Cantidad de pisos2', 'Tipo de casaCasa', 'OrientaciónSur', 'Mantenimiento250 MXN'],,,
Casa En Fraccionamiento Seminuevo Y Excelente Ubicación Arf,3300000,"Santiago De Querétaro, Centro, Querétaro, QuerétaroVer información de la zona","['Superficie total90 m²', 'Superficie construida102 m²', 'Recámaras3', 'Baños2', 'Estacionamientos2', 'Es propiedad en remateNo', 'Antigüedad0 años', 'Ambientes6', 'Bodegas0', 'Cantidad de pisos0', 'Tipo de casaCasa', 'OrientaciónNorte', 'Mantenimiento0 MXN']",['Superficie total90 m²', 'Superficie construida102 m²', 'Recámaras3', 'Baños2', 'Estacionamientos2', 'Es propiedad en remateNo', 'Antigüedad0 años', 'Ambientes6', 'Bodegas0', 'Cantidad de pisos0', 'Tipo de casaCasa', 'OrientaciónNorte', 'Mantenimiento0 MXN'],,,
Casa Con Excelente Mantenimiento Y Ubicación. Arf,1220000,"Santiago De Querétaro, Centro, Querétaro, QuerétaroVer información de la zona","['Superficie total110 m²', 'Superficie construida180 m²', 'Recámaras3', 'Baños1', 'Estacionamientos2', 'Es propiedad en remateSí', 'Antigüedad5 años', 'Ambientes11', 'Bodegas0', 'Cantidad de pisos2', 'Tipo de casaCasa', 'OrientaciónNorte', 'Mantenimiento1 MXN']",['Superficie total110 m²', 'Superficie construida180 m²', 'Recámaras3', 'Baños1', 'Estacionamientos2', 'Es propiedad en remateSí', 'Antigüedad5 años', 'Ambientes11', 'Bodegas0', 'Cantidad de pisos2', 'Tipo de casaCasa', 'OrientaciónNorte', 'Mantenimiento1 MXN'],,,
Rcv Casa Venta El Refugio,2750000,"Residencial El Refugio, Querétaro, QuerétaroVer información de la zona","['Superficie total114 m²', 'Superficie construida114 m²', 'Recámaras3', 'Baños2', 'Estacionamientos2', 'Es propiedad en remateNo', 'Antigüedad9 años', 'Ambientes6', 'Bodegas0', 'Cantidad de pisos0', 'Tipo de casaCasa', 'OrientaciónNorte', 'Mantenimiento921 MXN']",['Superficie total114 m²', 'Superficie construida114 m²', 'Recámaras3', 'Baños2', 'Estacionamientos2', 'Es propiedad en remateNo', 'Antigüedad9 años', 'Ambientes6', 'Bodegas0', 'Cantidad de pisos0', 'Tipo de casaCasa', 'OrientaciónNorte', 'Mantenimiento921 MXN'],,,
Rcv Casa Venta Lomas De Juriquilla,7350000,"Lomas de Juriquilla, Querétaro, Querétaro","['Superficie total278 m²', 'Superficie construida329 m²', 'Recámaras4', 'Baños5', 'Estacionamientos3', 'Es propiedad en remateNo', 'Antigüedad0 años', 'Ambientes9', 'Bodegas0', 'Cantidad de pisos0', 'Tipo de casaCasa', 'OrientaciónNorte', 'Mantenimiento0 MXN']",['Superficie total278 m²', 'Superficie construida329 m²', 'Recámaras4', 'Baños5', 'Estacionamientos3', 'Es propiedad en remateNo', 'Antigüedad0 años', 'Ambientes9', 'Bodegas0', 'Cantidad de pisos0', 'Tipo de casaCasa', 'OrientaciónNorte', 'Mantenimiento0 MXN'],,,
Casa Parque 2000,2850000,"Centro, Querétaro, QuerétaroVer información de la zona","['Superficie total108 m²', 'Superficie construida122 m²', 'Recámaras3', 'Baños2', 'Estacionamientos2', 'Es propiedad en remateNo', 'Antigüedad0 años', 'Ambientes6', 'Bodegas0', 'Mantenimiento1,250 MXN']",['Superficie total108 m²', 'Superficie construida122 m²', 'Recámaras3', 'Baños2', 'Estacionamientos2', 'Es propiedad en remateNo', 'Antigüedad0 años', 'Ambientes6', 'Bodegas0', 'Mantenimiento1,250 MXN'],,,,,
"Bengonias, Fundadores Felix, Los Fundadores , Queretaro.",7800000,"Fundadores, Los Fundadores, Querétaro, QuerétaroVer información de la zona","['Superficie total165 m²', 'Superficie construida310 m²', 'Recámaras4', 'Baños5', 'Estacionamientos3', 'Es propiedad en remateNo', 'Antigüedad0 años', 'Ambientes9', 'Bodegas0', 'Cantidad de pisos0', 'Tipo de casaCasa', 'OrientaciónNorte', 'Mantenimiento0 MXN']",['Superficie total165 m²', 'Superficie construida310 m²', 'Recámaras4', 'Baños5', 'Estacionamientos3', 'Es propiedad en remateNo', 'Antigüedad0 años', 'Ambientes9', 'Bodegas0', 'Cantidad de pisos0', 'Tipo de casaCasa', 'OrientaciónNorte', 'Mantenimiento0 MXN'],,,
"Hermosa Casa En Venta En Avenida Santa Catarina, Villas Del Mesón, Juriquilla, Querétaro, México. Cmr",351000,"Avenida Santa Catarina, Villas Del Mesón, Querétaro, QuerétaroVer información de la zona","['Superficie total123 m²', 'Superficie construida280 m²', 'Recámaras5', 'Baños3', 'Estacionamientos1', 'Es propiedad en remateSí', 'Antigüedad18 años', 'Ambientes1', 'Bodegas1', 'Cantidad de pisos3', 'Tipo de casaCasa', 'OrientaciónSur']",['Superficie total123 m²', 'Superficie construida280 m²', 'Recámaras5', 'Baños3', 'Estacionamientos1', 'Es propiedad en remateSí', 'Antigüedad18 años', 'Ambientes1', 'Bodegas1', 'Cantidad de pisos3', 'Tipo de casaCasa', 'OrientaciónSur'],,,,
"Sk01- Casa En Remate Bancario En C. Jose Villaumbrales, Hidalgo, Santiago Queretaro, Qro. (65% Debajo De Su Valor Comercial, Solo Recursos Propios)",749000,"José Villaumbrales, Hidalgo, Querétaro, QuerétaroVer información de la zona","['Superficie total523 m²', 'Superficie construida523 m²', 'Recámaras4', 'Baños3', 'Estacionamientos4', 'Es propiedad en remateSí', 'Antigüedad12 años', 'Ambientes0', 'Bodegas0', 'Cantidad de pisos3', 'Tipo de casaCasa', 'OrientaciónPoniente', 'Mantenimiento0 MXN']",['Superficie total523 m²', 'Superficie construida523 m²', 'Recámaras4', 'Baños3', 'Estacionamientos4', 'Es propiedad en remateSí', 'Antigüedad12 años', 'Ambientes0', 'Bodegas0', 'Cantidad de pisos3', 'Tipo de casaCasa', 'OrientaciónPoniente', 'Mantenimiento0 MXN'],,,
Casa Venta Raquet Club Jurica,357000,"Jurica, Querétaro, QuerétaroVer información de la zona","['Superficie total100 m²', 'Superficie construida100 m²', 'Recámaras3', 'Baños1', 'Estacionamientos1', 'Es propiedad en remateSí', 'Antigüedad16 años', 'Ambientes1', 'Bodegas1', 'Cantidad de pisos1', 'Tipo de casaCasa', 'OrientaciónSur', 'Mantenimiento1,000 MXN']",['Superficie total100 m²', 'Superficie construida100 m²', 'Recámaras3', 'Baños1', 'Estacionamientos1', 'Es propiedad en remateSí', 'Antigüedad16 años', 'Ambientes1', 'Bodegas1', 'Cantidad de pisos1', 'Tipo de casaCasa', 'OrientaciónSur', 'Mantenimiento1,000 MXN'],,
Casa En Venta Centro Historico,6800000,"Centro, Querétaro, QuerétaroVer información de la zona","['Superficie total516 m²', 'Superficie construida724 m²', 'Recámaras6', 'Baños5', 'Estacionamientos3', 'Es propiedad en remateNo', 'Antigüedad0 años', 'Ambientes13', 'Bodegas0', 'Cantidad de pisos0', 'Tipo de casaCasa', 'OrientaciónNorte', 'Mantenimiento0 MXN']",['Superficie total516 m²', 'Superficie construida724 m²', 'Recámaras6', 'Baños5', 'Estacionamientos3', 'Es propiedad en remateNo', 'Antigüedad0 años', 'Ambientes13', 'Bodegas0', 'Cantidad de pisos0', 'Tipo de casaCasa', 'OrientaciónNorte', 'Mantenimiento0 MXN'],,,
Casa En Venta En Jurica Campestre De 3 Recámaras Con Maravilloso Jardín.,12650000,"Jurica, Querétaro, QuerétaroVer información de la zona","['Superficie total330 m²', 'Superficie construida354 m²', 'Recámaras4', 'Baños3', 'Estacionamientos0', 'Es propiedad en remateNo', 'Antigüedad0 años', 'Ambientes7', 'Bodegas0', 'Cantidad de pisos0', 'Tipo de casaCasa', 'OrientaciónNorte', 'Mantenimiento0 MXN']",['Superficie total330 m²', 'Superficie construida354 m²', 'Recámaras4', 'Baños3', 'Estacionamientos0', 'Es propiedad en remateNo', 'Antigüedad0 años', 'Ambientes7', 'Bodegas0', 'Cantidad de pisos0', 'Tipo de casaCasa', 'OrientaciónNorte', 'Mantenimiento0 MXN'],,,
Vive En Juriquilla Central ¡¡¡¡¡¡,3300000,"Cerro El Nabo 319, Juriquilla, Querétaro, México, Juriquilla Privada, Querétaro, QuerétaroVer información de la zona","['Superficie total310 m²', 'Superficie construida260 m²', 'Recámaras3', 'Baños3', 'Estacionamientos4', 'Es propiedad en remateNo', 'Antigüedad0 años', 'Ambientes6', 'Bodegas0', 'Mantenimiento0 MXN']",['Superficie total310 m²', 'Superficie construida260 m²', 'Recámaras3', 'Baños3', 'Estacionamientos4', 'Es propiedad en remateNo', 'Antigüedad0 años', 'Ambientes6', 'Bodegas0', 'Mantenimiento0 MXN'],,,,,,
Casa En Venta Y Renta Juriquilla San Francisco,5700000,"San Francisco Juriquilla, Querétaro, QuerétaroVer información de la zona","['Superficie total321 m²', 'Superficie construida354 m²', 'Recámaras4', 'Baños4', 'Estacionamientos2', 'Es propiedad en remateNo', 'Antigüedad17 años', 'Ambientes6', 'Bodegas1', 'Cantidad de pisos2', 'Tipo de casaCasa', 'OrientaciónSur', 'Mantenimiento550 MXN']",['Superficie total321 m²', 'Superficie construida354 m²', 'Recámaras4', 'Baños4', 'Estacionamientos2', 'Es propiedad en remateNo', 'Antigüedad17 años', 'Ambientes6', 'Bodegas1', 'Cantidad de pisos2', 'Tipo de casaCasa', 'OrientaciónSur', 'Mantenimiento550 MXN'],,,
"Casa En Venta En Las Hadas, Cerca De Plaza Del Parque",960000,"Calle Mar De Alaska 10, Las Hadas, Querétaro, QuerétaroVer información de la zona","['Superficie total476 m²', 'Superficie construida215 m²', 'Recámaras3', 'Baños2', 'Estacionamientos4', 'Es propiedad en remateNo', 'Antigüedad15 años', 'Ambientes6', 'Bodegas0', 'Cantidad de pisos0', 'Tipo de casaCasa', 'OrientaciónNorte', 'Mantenimiento0 MXN']",['Superficie total476 m²', 'Superficie construida215 m²', 'Recámaras3', 'Baños2', 'Estacionamientos4', 'Es propiedad en remateNo', 'Antigüedad15 años', 'Ambientes6', 'Bodegas0', 'Cantidad de pisos0', 'Tipo de casaCasa', 'OrientaciónNorte', 'Mantenimiento0 MXN'],,,
Rcv Casa Venta Mision San Jeronimo,3600000,"Misión de San Jeronimo, Querétaro, QuerétaroVer información de la zona","['Superficie total195 m²', 'Superficie construida182 m²', 'Recámaras3', 'Baños3', 'Estacionamientos2', 'Es propiedad en remateNo', 'Antigüedad15 años', 'Ambientes4', 'Bodegas0', 'Cantidad de pisos2', 'Tipo de casaCasa', 'OrientaciónPoniente', 'Mantenimiento1 MXN']",['Superficie total195 m²', 'Superficie construida182 m²', 'Recámaras3', 'Baños3', 'Estacionamientos2', 'Es propiedad en remateNo', 'Antigüedad15 años', 'Ambientes4', 'Bodegas0', 'Cantidad de pisos2', 'Tipo de casaCasa', 'OrientaciónPoniente', 'Mantenimiento1 MXN'],,,
"Venta De Amplia Casa En Paseos Del Pedregal, Querétaro, México, Eg. ",8390000,"Granito 3200, Paseos Del Pedregal, Querétaro, QuerétaroVer información de la zona","['Superficie total247 m²', 'Superficie construida256 m²', 'Recámaras3', 'Baños2', 'Estacionamientos3', 'Es propiedad en remateNo', 'Antigüedad25 años', 'Bodegas1', 'Cantidad de pisos2', 'Tipo de casaCasa']",['Superficie total247 m²', 'Superficie construida256 m²', 'Recámaras3', 'Baños2', 'Estacionamientos3', 'Es propiedad en remateNo', 'Antigüedad25 años', 'Bodegas1', 'Cantidad de pisos2', 'Tipo de casaCasa'],,,,,,
Cómoda Y Acogedora Casa Oportunidad Mercurisantiago De Querétaro Queretaro México Gj-rl A,883300,"C. Pedro Escobedo, Mercurio, Querétaro, QuerétaroVer información de la zona","['Superficie total316 m²', 'Superficie construida450 m²', 'Recámaras3', 'Baños3', 'Estacionamientos2', 'Es propiedad en remateNo', 'Antigüedad8 años', 'Ambientes7', 'Bodegas0', 'Cantidad de pisos0', 'Tipo de casaCasa', 'OrientaciónNorte', 'Mantenimiento0 MXN']",['Superficie total316 m²', 'Superficie construida450 m²', 'Recámaras3', 'Baños3', 'Estacionamientos2', 'Es propiedad en remateNo', 'Antigüedad8 años', 'Ambientes7', 'Bodegas0', 'Cantidad de pisos0', 'Tipo de casaCasa', 'OrientaciónNorte', 'Mantenimiento0 MXN'],,,
Linda Y Acogedora Casa Oportunidad Colinas Del Cimatario Santiago De Querétaro Queretaro México Gj-rl A,860000,"Cerro De Acasulco, Colinas Del Cimatario, Querétaro, QuerétaroVer información de la zona","['Superficie total100 m²', 'Superficie construida100 m²', 'Recámaras3', 'Baños2', 'Estacionamientos2', 'Es propiedad en remateSí', 'Antigüedad20 años', 'Ambientes0', 'Bodegas0', 'Cantidad de pisos2', 'Tipo de casaCasa', 'OrientaciónSur', 'Mantenimiento100 MXN']",['Superficie total100 m²', 'Superficie construida100 m²', 'Recámaras3', 'Baños2', 'Estacionamientos2', 'Es propiedad en remateSí', 'Antigüedad20 años', 'Ambientes0', 'Bodegas0', 'Cantidad de pisos2', 'Tipo de casaCasa', 'OrientaciónSur', 'Mantenimiento100 MXN'],,,
Casa Venta Vista Hermosa,1340000,"Vista Hermosa, Querétaro, QuerétaroVer información de la zona","['Superficie total160 m²', 'Superficie construida185 m²', 'Recámaras3', 'Baños3', 'Estacionamientos2', 'Es propiedad en remateNo', 'Antigüedad18 años', 'Ambientes5', 'Bodegas0', 'Cantidad de pisos2', 'Tipo de casaCasa', 'OrientaciónPoniente', 'Mantenimiento1 MXN']",['Superficie total160 m²', 'Superficie construida185 m²', 'Recámaras3', 'Baños3', 'Estacionamientos2', 'Es propiedad en remateNo', 'Antigüedad18 años', 'Ambientes5', 'Bodegas0', 'Cantidad de pisos2', 'Tipo de casaCasa', 'OrientaciónPoniente', 'Mantenimiento1 MXN'],,,
"Casa De Recuperación Bancaria, En Calle Prudencia Grifel, La Joya, Querétaro, ¡no Créditos!",5995900,"Prudencia Grifel 714, La Joya, Querétaro, QuerétaroVer información de la zona","['Superficie total288 m²', 'Superficie construida388 m²', 'Recámaras3', 'Baños3', 'Estacionamientos2', 'Es propiedad en remateNo', 'Antigüedad18 años', 'Ambientes4', 'Bodegas1', 'Cantidad de pisos2', 'Tipo de casaCasa', 'OrientaciónPoniente', 'Mantenimiento1 MXN']",['Superficie total288 m²', 'Superficie construida388 m²', 'Recámaras3', 'Baños3', 'Estacionamientos2', 'Es propiedad en remateNo', 'Antigüedad18 años', 'Ambientes4', 'Bodegas1', 'Cantidad de pisos2', 'Tipo de casaCasa', 'OrientaciónPoniente', 'Mantenimiento1 MXN'],,,
"Casa En Venta En Col. El Tintero, Querétaro. Cymo",1250000,"C. Literatura 1 - 300, Ex-Hacienda El Tintero, Querétaro, QuerétaroVer información de la zona","['Superficie total326 m²', 'Superficie construida486 m²', 'Recámaras4', 'Baños4', 'Estacionamientos2', 'Es propiedad en remateNo', 'Antigüedad32 años', 'Ambientes9', 'Bodegas0', 'Cantidad de pisos0', 'Tipo de casaCasa', 'OrientaciónNorte', 'Mantenimiento0 MXN']",['Superficie total326 m²', 'Superficie construida486 m²', 'Recámaras4', 'Baños4', 'Estacionamientos2', 'Es propiedad en remateNo', 'Antigüedad32 años', 'Ambientes9', 'Bodegas0', 'Cantidad de pisos0', 'Tipo de casaCasa', 'OrientaciónNorte', 'Mantenimiento0 MXN'],,,
"Casa En Venta En Los Nogales 39, Cdmx. Sh05",1110000,"Los Nogales 39, Pueblo Nuevo, Querétaro, QuerétaroVer información de la zona","['Superficie total100 m²', 'Superficie construida60 m²', 'Recámaras3', 'Baños2', 'Estacionamientos2', 'Es propiedad en remateSí', 'Antigüedad15 años', 'Ambientes5', 'Bodegas0', 'Cantidad de pisos2', 'Tipo de casaCasa', 'OrientaciónSur', 'Mantenimiento250 MXN']",['Superficie total100 m²', 'Superficie construida60 m²', 'Recámaras3', 'Baños2', 'Estacionamientos2', 'Es propiedad en remateSí', 'Antigüedad15 años', 'Ambientes5', 'Bodegas0', 'Cantidad de pisos2', 'Tipo de casaCasa', 'OrientaciónSur', 'Mantenimiento250 MXN'],,,
"Casa En Venta, Angeles Mision Mariana Candiles Qro, Con Recursos Propios! Hha",1105000,"Ángeles, Candiles, Querétaro, QuerétaroVer información de la zona","['Superficie total126 m²', 'Superficie construida120 m²', 'Recámaras3', 'Baños1', 'Estacionamientos1', 'Es propiedad en remateSí', 'Antigüedad10 años', 'Ambientes8', 'Bodegas0', 'Cantidad de pisos2', 'Tipo de casaCasa', 'OrientaciónPoniente', 'Mantenimiento1 MXN']",['Superficie total126 m²', 'Superficie construida120 m²', 'Recámaras3', 'Baños1', 'Estacionamientos1', 'Es propiedad en remateSí', 'Antigüedad10 años', 'Ambientes8', 'Bodegas0', 'Cantidad de pisos2', 'Tipo de casaCasa', 'OrientaciónPoniente', 'Mantenimiento1 MXN'],,,
Casa En Priv. Parques Del Alamo - V E N T A  (mt),1700000,"Casa En Venta - Pri. Parques Del Alamo  (mt), Querétaro, QuerétaroVer información de la zona","['Superficie total155 m²', 'Superficie construida155 m²', 'Recámaras3', 'Baños2', 'Estacionamientos2', 'Es propiedad en remateNo', 'Antigüedad18 años', 'Ambientes5', 'Bodegas0', 'Cantidad de pisos2', 'Tipo de casaCasa', 'OrientaciónPoniente', 'Mantenimiento1 MXN']",['Superficie total155 m²', 'Superficie construida155 m²', 'Recámaras3', 'Baños2', 'Estacionamientos2', 'Es propiedad en remateNo', 'Antigüedad18 años', 'Ambientes5', 'Bodegas0', 'Cantidad de pisos2', 'Tipo de casaCasa', 'OrientaciónPoniente', 'Mantenimiento1 MXN'],,,
Casa Venta Altozano Cond. Flama,900000,"Paseos Del Pedregal, Querétaro, QuerétaroVer información de la zona","['Superficie total250 m²', 'Superficie construida320 m²', 'Recámaras4', 'Baños3', 'Estacionamientos2', 'Es propiedad en remateSí', 'Antigüedad10 años', 'Ambientes1', 'Bodegas1', 'Cantidad de pisos2', 'Tipo de casaCasa', 'OrientaciónNorte', 'Mantenimiento0 MXN']",['Superficie total250 m²', 'Superficie construida320 m²', 'Recámaras4', 'Baños3', 'Estacionamientos2', 'Es propiedad en remateSí', 'Antigüedad10 años', 'Ambientes1', 'Bodegas1', 'Cantidad de pisos2', 'Tipo de casaCasa', 'OrientaciónNorte', 'Mantenimiento0 MXN'],,,
"¡¡jb-hermosa Casa En Juriquilla Queretaro, Excelente Oportunidad De Remate!!",3400000,"Blvd. Jurica La Campana 1167, Juriquilla, Juriquilla, Querétaro, QuerétaroVer información de la zona","['Superficie total120 m²', 'Superficie construida120 m²', 'Recámaras3', 'Baños2', 'Estacionamientos2', 'Es propiedad en remateSí', 'Antigüedad20 años', 'Ambientes18', 'Bodegas0', 'Cantidad de pisos2', 'Tipo de casaCasa', 'OrientaciónOriente', 'Mantenimiento1 MXN']",['Superficie total120 m²', 'Superficie construida120 m²', 'Recámaras3', 'Baños2', 'Estacionamientos2', 'Es propiedad en remateSí', 'Antigüedad20 años', 'Ambientes18', 'Bodegas0', 'Cantidad de pisos2', 'Tipo de casaCasa', 'OrientaciónOriente', 'Mantenimiento1 MXN'],,,
"Casa En Remate Bancario Piramide Del Pueblito, El Pueblito Corregidora, Querétaro De Arteaga. ¡casa En Remate! -jmjc7",5000000,"Av. Pirámide De La Luna 227, 76908 El Pueblito, Qro., Mexico, Candiles, Querétaro, QuerétaroVer información de la zona","['Superficie total190 m²', 'Superficie construida0 m²', 'Recámaras3', 'Baños2', 'Estacionamientos2', 'Es propiedad en remateNo', 'Antigüedad0 años', 'Ambientes8', 'Bodegas0', 'Cantidad de pisos2', 'Tipo de casaCasa', 'Tipo de propiedadCasa sola', 'Mantenimiento0 MXN']",['Superficie total190 m²', 'Superficie construida0 m²', 'Recámaras3', 'Baños2', 'Estacionamientos2', 'Es propiedad en remateNo', 'Antigüedad0 años', 'Ambientes8', 'Bodegas0', 'Cantidad de pisos2', 'Tipo de casaCasa', 'Tipo de propiedadCasa sola', 'Mantenimiento0 MXN'],,,
"Casa En Venta En C. Literatura 126, Ex-hacienda El Tintero, El Tintero, Santiago De Querétaro, Qro.- Inversión A Corto Plazo (ra)",949000,"C. Literatura 126, El Tintero, Querétaro, QuerétaroVer información de la zona","['Superficie total180 m²', 'Superficie construida205 m²', 'Recámaras3', 'Baños2', 'Estacionamientos2', 'Es propiedad en remateNo', 'Antigüedad3 años', 'Ambientes6', 'Bodegas0', 'Cantidad de pisos0', 'Tipo de casaCasa', 'OrientaciónNorte', 'Mantenimiento0 MXN']",['Superficie total180 m²', 'Superficie construida205 m²', 'Recámaras3', 'Baños2', 'Estacionamientos2', 'Es propiedad en remateNo', 'Antigüedad3 años', 'Ambientes6', 'Bodegas0', 'Cantidad de pisos0', 'Tipo de casaCasa', 'OrientaciónNorte', 'Mantenimiento0 MXN'],,,
"Casa En Venta En Punta Nte, Fracc. Casa De Arcos, Santiago De Querétaro, Qro. - Última Oportunidad (ra)",761993,"Punta Nte. 156, Ciudad del Sol, Querétaro, QuerétaroVer información de la zona","['Superficie total550 m²', 'Superficie construida550 m²', 'Recámaras5', 'Baños4', 'Estacionamientos4', 'Es propiedad en remateSí', 'Antigüedad7 años', 'Ambientes5', 'Bodegas1', 'Cantidad de pisos2', 'Tipo de casaCasa', 'OrientaciónPoniente', 'Mantenimiento1,000 MXN']",['Superficie total550 m²', 'Superficie construida550 m²', 'Recámaras5', 'Baños4', 'Estacionamientos4', 'Es propiedad en remateSí', 'Antigüedad7 años', 'Ambientes5', 'Bodegas1', 'Cantidad de pisos2', 'Tipo de casaCasa', 'OrientaciónPoniente', 'Mantenimiento1,000 MXN'],,
Cs- Casa De Remate Bancario En Querétaro ¡gran Oportunidad,1110900,"Cerro De Acasulco 107, Colinas Del Cimatario, Santiago De Querétaro, Colinas Del Cimatario, Querétaro, QuerétaroVer información de la zona","['Superficie total130 m²', 'Superficie construida190 m²', 'Recámaras3', 'Baños2', 'Estacionamientos1', 'Es propiedad en remateSí', 'Antigüedad15 años', 'Ambientes1', 'Bodegas0', 'Cantidad de pisos2', 'Tipo de casaCasa', 'OrientaciónPoniente', 'Mantenimiento0 MXN']",['Superficie total130 m²', 'Superficie construida190 m²', 'Recámaras3', 'Baños2', 'Estacionamientos1', 'Es propiedad en remateSí', 'Antigüedad15 años', 'Ambientes1', 'Bodegas0', 'Cantidad de pisos2', 'Tipo de casaCasa', 'OrientaciónPoniente', 'Mantenimiento0 MXN'],,,
"Casa En Remate Bancario - Areca  Santiago De Querétaro, Querétaro Eo/-",980900,"Areca 128, Los Robles, Querétaro, QuerétaroVer información de la zona","['Superficie total126 m²', 'Superficie construida120 m²', 'Recámaras3', 'Baños1', 'Estacionamientos1', 'Es propiedad en remateSí', 'Antigüedad0 años', 'Ambientes4', 'Bodegas0', 'Cantidad de pisos2', 'Tipo de casaCasa', 'OrientaciónNorte', 'Mantenimiento1 MXN']",['Superficie total126 m²', 'Superficie construida120 m²', 'Recámaras3', 'Baños1', 'Estacionamientos1', 'Es propiedad en remateSí', 'Antigüedad0 años', 'Ambientes4', 'Bodegas0', 'Cantidad de pisos2', 'Tipo de casaCasa', 'OrientaciónNorte', 'Mantenimiento1 MXN'],,,
"Casa En Venta Pie De La Cuesta, Queretaro. Recuperación Bancaria Laab1",730000,"Av. Pie De La Cuesta 3000 - 3300, Paseos Del Pedregal, Querétaro, QuerétaroVer información de la zona","['Superficie total74 m²', 'Superficie construida132 m²', 'Recámaras3', 'Baños1', 'Estacionamientos1', 'Es propiedad en remateSí', 'Antigüedad0 años', 'Ambientes4', 'Bodegas0', 'Cantidad de pisos2', 'Tipo de casaCasa', 'OrientaciónNorte', 'Mantenimiento1 MXN']",['Superficie total74 m²', 'Superficie construida132 m²', 'Recámaras3', 'Baños1', 'Estacionamientos1', 'Es propiedad en remateSí', 'Antigüedad0 años', 'Ambientes4', 'Bodegas0', 'Cantidad de pisos2', 'Tipo de casaCasa', 'OrientaciónNorte', 'Mantenimiento1 MXN'],,,
