House,Price,Ubication,Features,Total_Area_m^2,Built_Area_m^2,Bedrooms,Bathrooms,Parking,Property_for_sale,Age,Rooms,Storage,Number_of_floors,Type_of_house,Orientation,Maintenance,columnA,columnB,columnC
Casa Minimalista En Venta,5650000,"Juriquilla, Querétaro, QuerétaroVer información de la zona","['Superficie total286 m²', 'Superficie construida314 m²', 'Recámaras4', 'Baños5', 'Estacionamientos2', 'Es propiedad en remateNo', 'Antigüedad8 años', 'Ambientes10', 'Bodegas0', 'Cantidad de pisos0', 'Tipo de casaCasa', 'OrientaciónNorte', 'Mantenimiento0 MXN']",['Superficie total286 m²', 'Superficie construida314 m²', 'Recámaras4', 'Baños5', 'Estacionamientos2', 'Es propiedad en remateNo', 'Antigüedad8 años', 'Ambientes10', 'Bodegas0', 'Cantidad de pisos0', 'Tipo de casaCasa', 'OrientaciónNorte', 'Mantenimiento0 MXN'],,,
Casa En Venta En Las Haciendas En Ciudad Del Sol,1595000,"Casa En Venta En Las Haciendas En Ciudad Del Sol, Querétaro, QuerétaroVer información de la zona","['Superficie total69 m²', 'Superficie construida0 m²', 'Recámaras3', 'Baños1', 'Estacionamientos1', 'Es propiedad en remateNo', 'Antigüedad0 años', 'Ambientes0', 'Bodegas0', 'Cantidad de pisos2', 'Tipo de propiedadCasa sola', 'Mantenimiento0 MXN']",['Superficie total69 m²', 'Superficie construida0 m²', 'Recámaras3', 'Baños1', 'Estacionamientos1', 'Es propiedad en remateNo', 'Antigüedad0 años', 'Ambientes0', 'Bodegas0', 'Cantidad de pisos2', 'Tipo de propiedadCasa sola', 'Mantenimiento0 MXN'],,,,
Casa En Venta En Altozano,11190000,"Casa En Venta En Altozano, Querétaro, QuerétaroVer información de la zona","['Superficie total370 m²', 'Superficie construida0 m²', 'Recámaras4', 'Baños4', 'Estacionamientos3', 'Es propiedad en remateNo', 'Antigüedad0 años', 'Ambientes0', 'Bodegas0', 'Cantidad de pisos2', 'Tipo de casaCasa', 'Tipo de propiedadCasa sola', 'Mantenimiento0 MXN']",['Superficie total370 m²', 'Superficie construida0 m²', 'Recámaras4', 'Baños4', 'Estacionamientos3', 'Es propiedad en remateNo', 'Antigüedad0 años', 'Ambientes0', 'Bodegas0', 'Cantidad de pisos2', 'Tipo de casaCasa', 'Tipo de propiedadCasa sola', 'Mantenimiento0 MXN'],,,
Iluminada Y Cómoda Casa Oportunidad La Joya Santiago De Querétaro Querétaro México Ojac-02,790000,"Blvd. Dolores Del Río, La Joya, Querétaro, QuerétaroVer información de la zona","['Superficie total150 m²', 'Superficie construida195 m²', 'Recámaras3', 'Baños3', 'Estacionamientos2', 'Es propiedad en remateNo', 'Antigüedad18 años', 'Ambientes4', 'Bodegas1', 'Cantidad de pisos2', 'Tipo de casaCasa', 'OrientaciónPoniente', 'Mantenimiento1 MXN']",['Superficie total150 m²', 'Superficie construida195 m²', 'Recámaras3', 'Baños3', 'Estacionamientos2', 'Es propiedad en remateNo', 'Antigüedad18 años', 'Ambientes4', 'Bodegas1', 'Cantidad de pisos2', 'Tipo de casaCasa', 'OrientaciónPoniente', 'Mantenimiento1 MXN'],,,
"¡¡jb-excelente Propiedad En Cumbres Del Lago Queretaro, Unica Oportunidad De Remate!!",849000,"Lago Eslabón 101, Cumbres Del Lago, Juriquilla, Cumbres Del Lago, Querétaro, QuerétaroVer información de la zona","['Superficie total400 m²', 'Superficie construida400 m²', 'Recámaras5', 'Baños4', 'Estacionamientos4', 'Es propiedad en remateSí', 'Antigüedad7 años', 'Ambientes5', 'Bodegas1', 'Cantidad de pisos2', 'Tipo de casaCasa', 'OrientaciónPoniente', 'Mantenimiento1,000 MXN']",['Superficie total400 m²', 'Superficie construida400 m²', 'Recámaras5', 'Baños4', 'Estacionamientos4', 'Es propiedad en remateSí', 'Antigüedad7 años', 'Ambientes5', 'Bodegas1', 'Cantidad de pisos2', 'Tipo de casaCasa', 'OrientaciónPoniente', 'Mantenimiento1,000 MXN'],,
"¡¡jb-hermosa Casa En Juriquilla Queretaro, Gran Oportunidad De Remate!!",849000,"Cerro El Divisadero 101, Privada Juriquilla, Santa Rosa Jáuregui, Santa Rosa De Jáuregui, Querétaro, QuerétaroVer información de la zona","['Superficie total330 m²', 'Superficie construida330 m²', 'Recámaras4', 'Baños3', 'Estacionamientos2', 'Es propiedad en remateSí', 'Antigüedad5 años', 'Ambientes5', 'Bodegas1', 'Cantidad de pisos2', 'Tipo de casaCasa', 'OrientaciónOriente', 'Mantenimiento1,000 MXN']",['Superficie total330 m²', 'Superficie construida330 m²', 'Recámaras4', 'Baños3', 'Estacionamientos2', 'Es propiedad en remateSí', 'Antigüedad5 años', 'Ambientes5', 'Bodegas1', 'Cantidad de pisos2', 'Tipo de casaCasa', 'OrientaciónOriente', 'Mantenimiento1,000 MXN'],,
"Casa En Venta Francisco Frías Alcocer 206 Candiles, Queretaro./ Recuperación Bancaria Laab1",2400000,"Francisco Frías Alcocer 206, Candiles, Querétaro, QuerétaroVer información de la zona","['Superficie total130 m²', 'Superficie construida220 m²', 'Recámaras3', 'Baños3', 'Estacionamientos2', 'Es propiedad en remateSí', 'Antigüedad15 años', 'Ambientes0', 'Bodegas1', 'Cantidad de pisos2', 'Tipo de casaCasa', 'OrientaciónPoniente', 'Mantenimiento0 MXN']",['Superficie total130 m²', 'Superficie construida220 m²', 'Recámaras3', 'Baños3', 'Estacionamientos2', 'Es propiedad en remateSí', 'Antigüedad15 años', 'Ambientes0', 'Bodegas1', 'Cantidad de pisos2', 'Tipo de casaCasa', 'OrientaciónPoniente', 'Mantenimiento0 MXN'],,,
"¡¡jb-hermosa Casa En Cumbres Del Lago Queretaro, Unica Oportunidad De Remate!! ",749000,"Lago De Chapala 110, Cumbres Del Lago, Juriquilla, Cumbres Del Lago, Querétaro, QuerétaroVer información de la zona","['Superficie total310 m²', 'Superficie construida310 m²', 'Recámaras4', 'Baños3', 'Estacionamientos2', 'Es propiedad en remateSí', 'Antigüedad7 años', 'Ambientes5', 'Bodegas1', 'Cantidad de pisos2', 'Tipo de casaCasa', 'OrientaciónPoniente', 'Mantenimiento1,000 MXN']",['Superficie total310 m²', 'Superficie construida310 m²', 'Recámaras4', 'Baños3', 'Estacionamientos2', 'Es propiedad en remateSí', 'Antigüedad7 años', 'Ambientes5', 'Bodegas1', 'Cantidad de pisos2', 'Tipo de casaCasa', 'OrientaciónPoniente', 'Mantenimiento1,000 MXN'],,
"¡¡jb-hermosa Casa En Villas Del Meson Queretaro, Gran Oportunidad De Remate!!",849000,"Hacienda Montenegro 113, Villas Del Mesón, Juriquilla, Villas Del Mesón, Querétaro, QuerétaroVer información de la zona","['Superficie total560 m²', 'Superficie construida560 m²', 'Recámaras4', 'Baños3', 'Estacionamientos3', 'Es propiedad en remateSí', 'Antigüedad7 años', 'Ambientes5', 'Bodegas1', 'Cantidad de pisos2', 'Tipo de casaCasa', 'OrientaciónPoniente', 'Mantenimiento1,000 MXN']",['Superficie total560 m²', 'Superficie construida560 m²', 'Recámaras4', 'Baños3', 'Estacionamientos3', 'Es propiedad en remateSí', 'Antigüedad7 años', 'Ambientes5', 'Bodegas1', 'Cantidad de pisos2', 'Tipo de casaCasa', 'OrientaciónPoniente', 'Mantenimiento1,000 MXN'],,
"¡¡jb-hermosa Casa En Milenio Tres Queretaro, Gran Oportunidad De Remate!!",849000,"Senda Del Rocío 24, Milenio Iii, Santiago De Querétaro, Milenio III, Querétaro, QuerétaroVer información de la zona","['Superficie total130 m²', 'Superficie construida130 m²', 'Recámaras3', 'Baños2', 'Estacionamientos2', 'Es propiedad en remateSí', 'Antigüedad7 años', 'Ambientes5', 'Bodegas1', 'Cantidad de pisos2', 'Tipo de casaCasa', 'OrientaciónPoniente', 'Mantenimiento1,000 MXN']",['Superficie total130 m²', 'Superficie construida130 m²', 'Recámaras3', 'Baños2', 'Estacionamientos2', 'Es propiedad en remateSí', 'Antigüedad7 años', 'Ambientes5', 'Bodegas1', 'Cantidad de pisos2', 'Tipo de casaCasa', 'OrientaciónPoniente', 'Mantenimiento1,000 MXN'],,
"¡¡jb-hermosa Casa En Cumbres Del Lago Queretaro, Grandiosa Oportunidad De Remate!!",849000,"Lago Chacamax 125, Cumbres Del Lago, Juriquilla, Cumbres Del Lago, Querétaro, QuerétaroVer información de la zona","['Superficie total350 m²', 'Superficie construida350 m²', 'Recámaras4', 'Baños4', 'Estacionamientos3', 'Es propiedad en remateSí', 'Antigüedad7 años', 'Ambientes5', 'Bodegas1', 'Cantidad de pisos2', 'Tipo de casaCasa', 'OrientaciónPoniente', 'Mantenimiento1,000 MXN']",['Superficie total350 m²', 'Superficie construida350 m²', 'Recámaras4', 'Baños4', 'Estacionamientos3', 'Es propiedad en remateSí', 'Antigüedad7 años', 'Ambientes5', 'Bodegas1', 'Cantidad de pisos2', 'Tipo de casaCasa', 'OrientaciónPoniente', 'Mantenimiento1,000 MXN'],,
Casa En Venta Merlin Risco Residencial Venceremos Querétaro/ Recuperación Bancaria Laab1,2400000,"Merlin 5, Venceremos, Querétaro, QuerétaroVer información de la zona","['Superficie total170 m²', 'Superficie construida180 m²', 'Recámaras3', 'Baños3', 'Estacionamientos2', 'Es propiedad en remateSí', 'Antigüedad10 años', 'Ambientes1', 'Bodegas1', 'Cantidad de pisos2', 'Tipo de casaCasa', 'OrientaciónPoniente', 'Mantenimiento0 MXN']",['Superficie total170 m²', 'Superficie construida180 m²', 'Recámaras3', 'Baños3', 'Estacionamientos2', 'Es propiedad en remateSí', 'Antigüedad10 años', 'Ambientes1', 'Bodegas1', 'Cantidad de pisos2', 'Tipo de casaCasa', 'OrientaciónPoniente', 'Mantenimiento0 MXN'],,,
"Casa En Colonia Cuesta Bonita, Querétaro, Querétaro Jr7-di",607929,"P.º Cta. Bonita 70, Cuesta Bonita, Querétaro, QuerétaroVer información de la zona","['Superficie total100 m²', 'Superficie construida130 m²', 'Recámaras3', 'Baños3', 'Estacionamientos2', 'Es propiedad en remateSí', 'Antigüedad10 años', 'Ambientes0', 'Bodegas0', 'Cantidad de pisos2', 'Tipo de casaCasa', 'OrientaciónNorte', 'Mantenimiento1,200 MXN']",['Superficie total100 m²', 'Superficie construida130 m²', 'Recámaras3', 'Baños3', 'Estacionamientos2', 'Es propiedad en remateSí', 'Antigüedad10 años', 'Ambientes0', 'Bodegas0', 'Cantidad de pisos2', 'Tipo de casaCasa', 'OrientaciónNorte', 'Mantenimiento1,200 MXN'],,
Casa En Venta En Juriquilla Con Cuarto De Servicio Dentro Del Condominio Alenas,3350000,"Av. Los Portones 1105, Alenas, Juriquilla, Valle de Juriquilla, Querétaro, QuerétaroVer información de la zona","['Superficie total128 m²', 'Superficie construida168 m²', 'Recámaras4', 'Baños4', 'Estacionamientos2', 'Es propiedad en remateNo', 'Antigüedad8 años', 'Ambientes8', 'Bodegas0', 'Cantidad de pisos2', 'Tipo de casaCasa', 'OrientaciónNorte', 'Mantenimiento1,200 MXN']",['Superficie total128 m²', 'Superficie construida168 m²', 'Recámaras4', 'Baños4', 'Estacionamientos2', 'Es propiedad en remateNo', 'Antigüedad8 años', 'Ambientes8', 'Bodegas0', 'Cantidad de pisos2', 'Tipo de casaCasa', 'OrientaciónNorte', 'Mantenimiento1,200 MXN'],,
Residencia En Venta En La Espiga - ¡diseño De Autor Y Lujo!,8725000,"Fray Junípero Serra, Querétaro, QuerétaroVer información de la zona","['Superficie total272 m²', 'Superficie construida323 m²', 'Recámaras4', 'Baños5', 'Estacionamientos3', 'Es propiedad en remateNo', 'Antigüedad0 años', 'Ambientes10', 'Bodegas0', 'Cantidad de pisos0', 'Tipo de casaCasa', 'OrientaciónNorte', 'Mantenimiento0 MXN']",['Superficie total272 m²', 'Superficie construida323 m²', 'Recámaras4', 'Baños5', 'Estacionamientos3', 'Es propiedad en remateNo', 'Antigüedad0 años', 'Ambientes10', 'Bodegas0', 'Cantidad de pisos0', 'Tipo de casaCasa', 'OrientaciónNorte', 'Mantenimiento0 MXN'],,,
Diseño Distintivo Con Doble Altura- La Vista Residencial,10790000,"La Vista Residencial, Querétaro, QuerétaroVer información de la zona","['Superficie total300 m²', 'Superficie construida390 m²', 'Recámaras3', 'Baños5', 'Estacionamientos3', 'Es propiedad en remateNo', 'Antigüedad0 años', 'Ambientes8', 'Bodegas0', 'Cantidad de pisos0', 'Tipo de casaCasa', 'OrientaciónNorte', 'Mantenimiento0 MXN']",['Superficie total300 m²', 'Superficie construida390 m²', 'Recámaras3', 'Baños5', 'Estacionamientos3', 'Es propiedad en remateNo', 'Antigüedad0 años', 'Ambientes8', 'Bodegas0', 'Cantidad de pisos0', 'Tipo de casaCasa', 'OrientaciónNorte', 'Mantenimiento0 MXN'],,,
Esquina Con Doble Frente- La Vista Residencial,7000000,"La Vista Residencial, Querétaro, QuerétaroVer información de la zona","['Superficie total300 m²', 'Superficie construida300 m²', 'Recámaras3', 'Baños5', 'Estacionamientos3', 'Es propiedad en remateNo', 'Antigüedad0 años', 'Ambientes8', 'Bodegas0', 'Cantidad de pisos0', 'Tipo de casaCasa', 'OrientaciónNorte', 'Mantenimiento0 MXN']",['Superficie total300 m²', 'Superficie construida300 m²', 'Recámaras3', 'Baños5', 'Estacionamientos3', 'Es propiedad en remateNo', 'Antigüedad0 años', 'Ambientes8', 'Bodegas0', 'Cantidad de pisos0', 'Tipo de casaCasa', 'OrientaciónNorte', 'Mantenimiento0 MXN'],,,
Diseño Distintivo Y Vanguardista- Juriquilla,10500000,"Juriquilla, Querétaro, QuerétaroVer información de la zona","['Superficie total251 m²', 'Superficie construida334 m²', 'Recámaras4', 'Baños5', 'Estacionamientos3', 'Es propiedad en remateNo', 'Antigüedad0 años', 'Ambientes9', 'Bodegas0', 'Cantidad de pisos0', 'Tipo de casaCasa', 'OrientaciónNorte', 'Mantenimiento0 MXN']",['Superficie total251 m²', 'Superficie construida334 m²', 'Recámaras4', 'Baños5', 'Estacionamientos3', 'Es propiedad en remateNo', 'Antigüedad0 años', 'Ambientes9', 'Bodegas0', 'Cantidad de pisos0', 'Tipo de casaCasa', 'OrientaciónNorte', 'Mantenimiento0 MXN'],,,
Residencia Con Acabados Premium- La Espiga,11450000,"Fray Junípero Serra, Querétaro, QuerétaroVer información de la zona","['Superficie total361 m²', 'Superficie construida361 m²', 'Recámaras3', 'Baños5', 'Estacionamientos3', 'Es propiedad en remateNo', 'Antigüedad0 años', 'Ambientes8', 'Bodegas0', 'Cantidad de pisos0', 'Tipo de casaCasa', 'OrientaciónNorte', 'Mantenimiento0 MXN']",['Superficie total361 m²', 'Superficie construida361 m²', 'Recámaras3', 'Baños5', 'Estacionamientos3', 'Es propiedad en remateNo', 'Antigüedad0 años', 'Ambientes8', 'Bodegas0', 'Cantidad de pisos0', 'Tipo de casaCasa', 'OrientaciónNorte', 'Mantenimiento0 MXN'],,,
"Casa En Venta En Ciudad Del Sol, Tu Hogar Ideal En Una Comunidad Segura",1849000,"Ciudad del Sol, Querétaro, QuerétaroVer información de la zona","['Superficie total112 m²', 'Superficie construida112 m²', 'Recámaras3', 'Baños2', 'Estacionamientos2', 'Es propiedad en remateNo', 'Antigüedad0 años', 'Ambientes6', 'Bodegas0', 'Cantidad de pisos0', 'Tipo de casaCasa', 'OrientaciónNorte', 'Mantenimiento0 MXN']",['Superficie total112 m²', 'Superficie construida112 m²', 'Recámaras3', 'Baños2', 'Estacionamientos2', 'Es propiedad en remateNo', 'Antigüedad0 años', 'Ambientes6', 'Bodegas0', 'Cantidad de pisos0', 'Tipo de casaCasa', 'OrientaciónNorte', 'Mantenimiento0 MXN'],,,
Una Nueva Forma De Vivir- Juriquilla,4100000,"Juriquilla, Querétaro, QuerétaroVer información de la zona","['Superficie total211 m²', 'Superficie construida161 m²', 'Recámaras3', 'Baños2', 'Estacionamientos2', 'Es propiedad en remateNo', 'Antigüedad7 años', 'Ambientes6', 'Bodegas0', 'Cantidad de pisos0', 'Tipo de casaCasa', 'OrientaciónNorte', 'Mantenimiento1,650 MXN']",['Superficie total211 m²', 'Superficie construida161 m²', 'Recámaras3', 'Baños2', 'Estacionamientos2', 'Es propiedad en remateNo', 'Antigüedad7 años', 'Ambientes6', 'Bodegas0', 'Cantidad de pisos0', 'Tipo de casaCasa', 'OrientaciónNorte', 'Mantenimiento1,650 MXN'],,
"Casa En Venta En Valle De Juriquilla, Diseño De Autor, Doble Altura, Roof Garden",4945000,"Juriquilla Santa Fe, Querétaro, QuerétaroVer información de la zona","['Superficie total162 m²', 'Superficie construida255 m²', 'Recámaras3', 'Baños5', 'Estacionamientos2', 'Es propiedad en remateNo', 'Antigüedad0 años', 'Ambientes8', 'Bodegas0', 'Cantidad de pisos0', 'Tipo de casaCasa', 'OrientaciónNorte', 'Mantenimiento0 MXN']",['Superficie total162 m²', 'Superficie construida255 m²', 'Recámaras3', 'Baños5', 'Estacionamientos2', 'Es propiedad en remateNo', 'Antigüedad0 años', 'Ambientes8', 'Bodegas0', 'Cantidad de pisos0', 'Tipo de casaCasa', 'OrientaciónNorte', 'Mantenimiento0 MXN'],,,
Casa En Venta En Real De Juriquilla Con 2 Recamaras En Planta Baja  Y 2 En Pa,4850000,"Real De Juriquilla (Paisano), Querétaro, Querétaro","['Superficie total160 m²', 'Superficie construida255 m²', 'Recámaras4', 'Baños4', 'Estacionamientos2', 'Es propiedad en remateNo', 'Antigüedad0 años', 'Ambientes10', 'Bodegas0', 'Mantenimiento0 MXN']",['Superficie total160 m²', 'Superficie construida255 m²', 'Recámaras4', 'Baños4', 'Estacionamientos2', 'Es propiedad en remateNo', 'Antigüedad0 años', 'Ambientes10', 'Bodegas0', 'Mantenimiento0 MXN'],,,,,,
Casa En Venta En Cumbres Del Cimatario Querétaro,6435000,"Cumbres del Cimatario, Querétaro, QuerétaroVer información de la zona","['Superficie total206 m²', 'Superficie construida263 m²', 'Recámaras4', 'Baños4', 'Estacionamientos3', 'Es propiedad en remateNo', 'Antigüedad0 años', 'Ambientes9', 'Bodegas0', 'Cantidad de pisos0', 'Tipo de casaCasa', 'OrientaciónNorte', 'Mantenimiento0 MXN']",['Superficie total206 m²', 'Superficie construida263 m²', 'Recámaras4', 'Baños4', 'Estacionamientos3', 'Es propiedad en remateNo', 'Antigüedad0 años', 'Ambientes9', 'Bodegas0', 'Cantidad de pisos0', 'Tipo de casaCasa', 'OrientaciónNorte', 'Mantenimiento0 MXN'],,,
Un Nuevo Estilo De Vida- Altozano,4500000,"Paseos Del Pedregal, Querétaro, QuerétaroVer información de la zona","['Superficie total302 m²', 'Superficie construida304 m²', 'Recámaras4', 'Baños3', 'Estacionamientos3', 'Es propiedad en remateNo', 'Antigüedad11 años', 'Ambientes9', 'Bodegas0', 'Cantidad de pisos0', 'Tipo de casaCasa', 'OrientaciónNorte', 'Mantenimiento0 MXN']",['Superficie total302 m²', 'Superficie construida304 m²', 'Recámaras4', 'Baños3', 'Estacionamientos3', 'Es propiedad en remateNo', 'Antigüedad11 años', 'Ambientes9', 'Bodegas0', 'Cantidad de pisos0', 'Tipo de casaCasa', 'OrientaciónNorte', 'Mantenimiento0 MXN'],,,
"Terraza, Amplio Jardín- Lomas De Juriquilla",6500000,"Juriquilla, Querétaro, QuerétaroVer información de la zona","['Superficie total280 m²', 'Superficie construida320 m²', 'Recámaras3', 'Baños4', 'Estacionamientos4', 'Es propiedad en remateNo', 'Antigüedad0 años', 'Ambientes8', 'Bodegas0', 'Mantenimiento0 MXN']",['Superficie total280 m²', 'Superficie construida320 m²', 'Recámaras3', 'Baños4', 'Estacionamientos4', 'Es propiedad en remateNo', 'Antigüedad0 años', 'Ambientes8', 'Bodegas0', 'Mantenimiento0 MXN'],,,,,,
"Residencia En Venta En Lomas De Juriquilla, 4ta Recámara En Pb Con Baño Completo",11190000,"Lomas de Juriquilla, Querétaro, QuerétaroVer información de la zona","['Superficie total300 m²', 'Superficie construida370 m²', 'Recámaras3', 'Baños5', 'Estacionamientos3', 'Es propiedad en remateNo', 'Antigüedad0 años', 'Ambientes8', 'Bodegas0', 'Cantidad de pisos0', 'Tipo de casaCasa', 'OrientaciónNorte', 'Mantenimiento0 MXN']",['Superficie total300 m²', 'Superficie construida370 m²', 'Recámaras3', 'Baños5', 'Estacionamientos3', 'Es propiedad en remateNo', 'Antigüedad0 años', 'Ambientes8', 'Bodegas0', 'Cantidad de pisos0', 'Tipo de casaCasa', 'OrientaciónNorte', 'Mantenimiento0 MXN'],,,
Diseño Único Y Vanguardista- La Vista Residencial,5980000,"La Vista Residencial, Querétaro, QuerétaroVer información de la zona","['Superficie total250 m²', 'Superficie construida286 m²', 'Recámaras3', 'Baños4', 'Estacionamientos3', 'Es propiedad en remateNo', 'Antigüedad0 años', 'Ambientes7', 'Bodegas0', 'Cantidad de pisos0', 'Tipo de casaCasa', 'OrientaciónNorte', 'Mantenimiento0 MXN']",['Superficie total250 m²', 'Superficie construida286 m²', 'Recámaras3', 'Baños4', 'Estacionamientos3', 'Es propiedad en remateNo', 'Antigüedad0 años', 'Ambientes7', 'Bodegas0', 'Cantidad de pisos0', 'Tipo de casaCasa', 'OrientaciónNorte', 'Mantenimiento0 MXN'],,,
Cómoda Residencia De Una Planta- Juriquilla,6000000,"Juriquilla, Querétaro, QuerétaroVer información de la zona","['Superficie total250 m²', 'Superficie construida264 m²', 'Recámaras4', 'Baños4', 'Estacionamientos3', 'Es propiedad en remateNo', 'Antigüedad0 años', 'Ambientes8', 'Bodegas0', 'Cantidad de pisos0', 'Tipo de casaCasa', 'OrientaciónNorte', 'Mantenimiento0 MXN']",['Superficie total250 m²', 'Superficie construida264 m²', 'Recámaras4', 'Baños4', 'Estacionamientos3', 'Es propiedad en remateNo', 'Antigüedad0 años', 'Ambientes8', 'Bodegas0', 'Cantidad de pisos0', 'Tipo de casaCasa', 'OrientaciónNorte', 'Mantenimiento0 MXN'],,,
Nuevas Emociones- Altozano,12390000,"Paseos Del Pedregal, Querétaro, QuerétaroVer información de la zona","['Superficie total310 m²', 'Superficie construida405 m²', 'Recámaras3', 'Baños5', 'Estacionamientos3', 'Es propiedad en remateNo', 'Antigüedad0 años', 'Ambientes8', 'Bodegas0', 'Cantidad de pisos0', 'Tipo de casaCasa', 'OrientaciónNorte', 'Mantenimiento0 MXN']",['Superficie total310 m²', 'Superficie construida405 m²', 'Recámaras3', 'Baños5', 'Estacionamientos3', 'Es propiedad en remateNo', 'Antigüedad0 años', 'Ambientes8', 'Bodegas0', 'Cantidad de pisos0', 'Tipo de casaCasa', 'OrientaciónNorte', 'Mantenimiento0 MXN'],,,
"4 Habitaciones, Amplio Jardín- Lomas Del Campanario Norte",10500000,"El Campanario, Querétaro, QuerétaroVer información de la zona","['Superficie total512 m²', 'Superficie construida366 m²', 'Recámaras3', 'Baños3', 'Estacionamientos3', 'Es propiedad en remateNo', 'Antigüedad17 años', 'Ambientes7', 'Bodegas0', 'Cantidad de pisos0', 'Tipo de casaCasa', 'OrientaciónNorte', 'Mantenimiento0 MXN']",['Superficie total512 m²', 'Superficie construida366 m²', 'Recámaras3', 'Baños3', 'Estacionamientos3', 'Es propiedad en remateNo', 'Antigüedad17 años', 'Ambientes7', 'Bodegas0', 'Cantidad de pisos0', 'Tipo de casaCasa', 'OrientaciónNorte', 'Mantenimiento0 MXN'],,,
Residencia Con Doble Altura- Altozano,7040000,"Paseos Del Pedregal, Querétaro, QuerétaroVer información de la zona","['Superficie total200 m²', 'Superficie construida270 m²', 'Recámaras3', 'Baños3', 'Estacionamientos2', 'Es propiedad en remateNo', 'Antigüedad0 años', 'Ambientes7', 'Bodegas0', 'Cantidad de pisos0', 'Tipo de casaCasa', 'OrientaciónNorte', 'Mantenimiento0 MXN']",['Superficie total200 m²', 'Superficie construida270 m²', 'Recámaras3', 'Baños3', 'Estacionamientos2', 'Es propiedad en remateNo', 'Antigüedad0 años', 'Ambientes7', 'Bodegas0', 'Cantidad de pisos0', 'Tipo de casaCasa', 'OrientaciónNorte', 'Mantenimiento0 MXN'],,,
Casa En Venta En Campanario Norte - Viva Con Calidad De Vida,11200000,"El Campanario, Querétaro, QuerétaroVer información de la zona","['Superficie total300 m²', 'Superficie construida350 m²', 'Recámaras4', 'Baños5', 'Estacionamientos3', 'Es propiedad en remateNo', 'Antigüedad0 años', 'Ambientes10', 'Bodegas0', 'Cantidad de pisos0', 'Tipo de casaCasa', 'OrientaciónNorte', 'Mantenimiento0 MXN']",['Superficie total300 m²', 'Superficie construida350 m²', 'Recámaras4', 'Baños5', 'Estacionamientos3', 'Es propiedad en remateNo', 'Antigüedad0 años', 'Ambientes10', 'Bodegas0', 'Cantidad de pisos0', 'Tipo de casaCasa', 'OrientaciónNorte', 'Mantenimiento0 MXN'],,,
Exclusiva Casa En Venta En Cumbres Del Lago Juriquilla - ¡lujo Y Confort!,7399000,"Cumbres Del Lago, Querétaro, Querétaro","['Superficie total200 m²', 'Superficie construida272 m²', 'Recámaras3', 'Baños4', 'Estacionamientos3', 'Es propiedad en remateNo', 'Antigüedad0 años', 'Ambientes7', 'Bodegas0', 'Cantidad de pisos0', 'Tipo de casaCasa', 'OrientaciónNorte', 'Mantenimiento0 MXN']",['Superficie total200 m²', 'Superficie construida272 m²', 'Recámaras3', 'Baños4', 'Estacionamientos3', 'Es propiedad en remateNo', 'Antigüedad0 años', 'Ambientes7', 'Bodegas0', 'Cantidad de pisos0', 'Tipo de casaCasa', 'OrientaciónNorte', 'Mantenimiento0 MXN'],,,
"Estrena Casa En El Refugio, Roof Garden, 3 Recámaras, 3 Baños, Estudio, Luxury",4250000,"Residencial El Refugio, Querétaro, QuerétaroVer información de la zona","['Superficie total122 m²', 'Superficie construida177 m²', 'Recámaras3', 'Baños3', 'Estacionamientos2', 'Es propiedad en remateNo', 'Antigüedad0 años', 'Ambientes7', 'Bodegas0', 'Cantidad de pisos0', 'Tipo de casaCasa', 'OrientaciónNorte', 'Mantenimiento0 MXN']",['Superficie total122 m²', 'Superficie construida177 m²', 'Recámaras3', 'Baños3', 'Estacionamientos2', 'Es propiedad en remateNo', 'Antigüedad0 años', 'Ambientes7', 'Bodegas0', 'Cantidad de pisos0', 'Tipo de casaCasa', 'OrientaciónNorte', 'Mantenimiento0 MXN'],,,
Tu Nuevo Hogar- Residencial El Refugio,10500000,"Residencial El Refugio, Querétaro, QuerétaroVer información de la zona","['Superficie total300 m²', 'Superficie construida505 m²', 'Recámaras3', 'Baños4', 'Estacionamientos3', 'Es propiedad en remateNo', 'Antigüedad0 años', 'Ambientes8', 'Bodegas0', 'Cantidad de pisos0', 'Tipo de casaCasa', 'OrientaciónNorte', 'Mantenimiento0 MXN']",['Superficie total300 m²', 'Superficie construida505 m²', 'Recámaras3', 'Baños4', 'Estacionamientos3', 'Es propiedad en remateNo', 'Antigüedad0 años', 'Ambientes8', 'Bodegas0', 'Cantidad de pisos0', 'Tipo de casaCasa', 'OrientaciónNorte', 'Mantenimiento0 MXN'],,,
Frente A Lago Y Extensas Áreas Verdes,4250000,"El Campanario, Querétaro, QuerétaroVer información de la zona","['Superficie total146 m²', 'Superficie construida193 m²', 'Recámaras3', 'Baños3', 'Estacionamientos2', 'Es propiedad en remateNo', 'Antigüedad0 años', 'Ambientes6', 'Bodegas0', 'Cantidad de pisos0', 'Tipo de casaCasa', 'OrientaciónNorte', 'Mantenimiento0 MXN']",['Superficie total146 m²', 'Superficie construida193 m²', 'Recámaras3', 'Baños3', 'Estacionamientos2', 'Es propiedad en remateNo', 'Antigüedad0 años', 'Ambientes6', 'Bodegas0', 'Cantidad de pisos0', 'Tipo de casaCasa', 'OrientaciónNorte', 'Mantenimiento0 MXN'],,,
