House,Price,Ubication,Features,Total_Area_m^2,Built_Area_m^2,Bedrooms,Bathrooms,Parking,Property_for_sale,Age,Rooms,Storage,Number_of_floors,Type_of_house,Orientation,Maintenance,columnA,columnB,columnC
"Estupenda E Iluminada Casa Oportunidad Villas Del Mesón Juriquilla, Queretaro México Gj-rl A",1510000,"Loma Dorada, Querétaro, QuerétaroVer información de la zona","['Superficie total523 m²', 'Superficie construida523 m²', 'Recámaras4', 'Baños4', 'Estacionamientos2', 'Es propiedad en remateNo', 'Antigüedad18 años', 'Ambientes6', 'Bodegas1', 'Cantidad de pisos3', 'Tipo de casaCasa', 'OrientaciónPoniente', 'Mantenimiento1 MXN']",['Superficie total523 m²', 'Superficie construida523 m²', 'Recámaras4', 'Baños4', 'Estacionamientos2', 'Es propiedad en remateNo', 'Antigüedad18 años', 'Ambientes6', 'Bodegas1', 'Cantidad de pisos3', 'Tipo de casaCasa', 'OrientaciónPoniente', 'Mantenimiento1 MXN'],,,
Casa Venta Frac La Ermita A Un Lado De Loma Dorada Queretaro,3250000,"De Los Ciruelos, San Isidro El Alto, Querétaro, QuerétaroVer información de la zona","['Superficie total136 m²', 'Superficie construida166 m²', 'Recámaras4', 'Baños3', 'Estacionamientos2', 'Es propiedad en remateNo', 'Antigüedad1 años', 'Ambientes8', 'Bodegas0', 'Mantenimiento1,370 MXN']",['Superficie total136 m²', 'Superficie construida166 m²', 'Recámaras4', 'Baños3', 'Estacionamientos2', 'Es propiedad en remateNo', 'Antigüedad1 años', 'Ambientes8', 'Bodegas0', 'Mantenimiento1,370 MXN'],,,,,
Casa En Remate Bancario En Querétaro Sc*,3300000,"Circuito Pizarra 622, San Isidro Juriquilla, Querétaro, Querétaro","['Superficie total945 m²', 'Superficie construida340 m²', 'Recámaras5', 'Baños3', 'Estacionamientos2', 'Es propiedad en remateSí', 'Antigüedad10 años', 'Ambientes0', 'Bodegas0', 'Cantidad de pisos0', 'Tipo de casaCasa', 'OrientaciónSur', 'Mantenimiento1 MXN']",['Superficie total945 m²', 'Superficie construida340 m²', 'Recámaras5', 'Baños3', 'Estacionamientos2', 'Es propiedad en remateSí', 'Antigüedad10 años', 'Ambientes0', 'Bodegas0', 'Cantidad de pisos0', 'Tipo de casaCasa', 'OrientaciónSur', 'Mantenimiento1 MXN'],,,
"Venta De Casa, Residencial Mila, San Isidro Juriquilla, Querétaro, Qro. Dn",1850000,"Juriquilla, Querétaro, QuerétaroVer información de la zona","['Superficie total198.58 m²', 'Superficie construida119.73 m²', 'Recámaras3', 'Baños2', 'Estacionamientos1', 'Es propiedad en remateSí', 'Antigüedad15 años', 'Ambientes0', 'Bodegas0', 'Cantidad de pisos0', 'Tipo de casaCasa', 'OrientaciónSur']",['Superficie total198.58 m²', 'Superficie construida119.73 m²', 'Recámaras3', 'Baños2', 'Estacionamientos1', 'Es propiedad en remateSí', 'Antigüedad15 años', 'Ambientes0', 'Bodegas0', 'Cantidad de pisos0', 'Tipo de casaCasa', 'OrientaciónSur'],,,,
Casa En Venta Modelo Qui-a Altos Juriquilla M2,7068750,"Paseos Del Pedregal, Querétaro, QuerétaroVer información de la zona","['Superficie total172 m²', 'Superficie construida325 m²', 'Recámaras3', 'Baños3', 'Estacionamientos2', 'Es propiedad en remateNo', 'Antigüedad0 años', 'Ambientes7', 'Bodegas0', 'Mantenimiento0 MXN']",['Superficie total172 m²', 'Superficie construida325 m²', 'Recámaras3', 'Baños3', 'Estacionamientos2', 'Es propiedad en remateNo', 'Antigüedad0 años', 'Ambientes7', 'Bodegas0', 'Mantenimiento0 MXN'],,,,,,
Rcv Casa En Altozano,4400000,"P.º De La Garza 69, Santa Fe, Querétaro, QuerétaroVer información de la zona","['Superficie total322 m²', 'Superficie construida216 m²', 'Recámaras3', 'Baños2', 'Estacionamientos4', 'Es propiedad en remateNo', 'Antigüedad5 años', 'Ambientes6', 'Bodegas0', 'Cantidad de pisos0', 'Tipo de casaCasa', 'OrientaciónNorte', 'Mantenimiento0 MXN']",['Superficie total322 m²', 'Superficie construida216 m²', 'Recámaras3', 'Baños2', 'Estacionamientos4', 'Es propiedad en remateNo', 'Antigüedad5 años', 'Ambientes6', 'Bodegas0', 'Cantidad de pisos0', 'Tipo de casaCasa', 'OrientaciónNorte', 'Mantenimiento0 MXN'],,,
"Casa En Venta En Santa Fe Tlacote, A 10 Minutos Del Centro, Muy Cerca De Galindas",2550000,"Campestre Italiana, Querétaro, QuerétaroVer información de la zona","['Superficie total117 m²', 'Superficie construida166 m²', 'Recámaras3', 'Baños2', 'Estacionamientos2', 'Es propiedad en remateNo', 'Antigüedad0 años', 'Ambientes3', 'Bodegas1', 'Cantidad de pisos3', 'Tipo de casaCasa', 'OrientaciónSur', 'Mantenimiento900 MXN']",['Superficie total117 m²', 'Superficie construida166 m²', 'Recámaras3', 'Baños2', 'Estacionamientos2', 'Es propiedad en remateNo', 'Antigüedad0 años', 'Ambientes3', 'Bodegas1', 'Cantidad de pisos3', 'Tipo de casaCasa', 'OrientaciónSur', 'Mantenimiento900 MXN'],,,
Rcv Casa Venta Campestre Italiana,5400000,"Loma Dorada, Querétaro, México, Loma Dorada, Querétaro, QuerétaroVer información de la zona","['Superficie total395 m²', 'Superficie construida338 m²', 'Recámaras4', 'Baños3', 'Estacionamientos4', 'Es propiedad en remateNo', 'Antigüedad11 años', 'Ambientes8', 'Bodegas0', 'Cantidad de pisos0', 'Tipo de casaCasa', 'OrientaciónNorte', 'Mantenimiento0 MXN']",['Superficie total395 m²', 'Superficie construida338 m²', 'Recámaras4', 'Baños3', 'Estacionamientos4', 'Es propiedad en remateNo', 'Antigüedad11 años', 'Ambientes8', 'Bodegas0', 'Cantidad de pisos0', 'Tipo de casaCasa', 'OrientaciónNorte', 'Mantenimiento0 MXN'],,,
Casa En Venta Loma Dorada Querétaro,11500000,"Lomas de Juriquilla, Querétaro, QuerétaroVer información de la zona","['Superficie total375 m²', 'Superficie construida512 m²', 'Recámaras4', 'Baños5', 'Estacionamientos3', 'Es propiedad en remateNo', 'Antigüedad16 años']",['Superficie total375 m²', 'Superficie construida512 m²', 'Recámaras4', 'Baños5', 'Estacionamientos3', 'Es propiedad en remateNo', 'Antigüedad16 años'],,,,,,,,,
Rcv Casa Venta Lomas De Juriquilla,5990000,"Campanario, El Campanario, Querétaro, QuerétaroVer información de la zona","['Superficie total251 m²', 'Superficie construida305 m²', 'Recámaras4', 'Baños4', 'Estacionamientos3', 'Es propiedad en remateNo', 'Antigüedad0 años', 'Ambientes10', 'Bodegas0', 'Cantidad de pisos0', 'Tipo de casaCasa', 'OrientaciónNorte', 'Mantenimiento0 MXN']",['Superficie total251 m²', 'Superficie construida305 m²', 'Recámaras4', 'Baños4', 'Estacionamientos3', 'Es propiedad en remateNo', 'Antigüedad0 años', 'Ambientes10', 'Bodegas0', 'Cantidad de pisos0', 'Tipo de casaCasa', 'OrientaciónNorte', 'Mantenimiento0 MXN'],,,
"Casa En El Campanario Con 5 Recámaras!, Una En Pb, Alberca Propia Y Departamento Independiente",14900000,"Cumbres Del Lago, Querétaro, Querétaro","['Superficie total800 m²', 'Superficie construida450 m²', 'Recámaras5', 'Baños5', 'Estacionamientos7', 'Es propiedad en remateNo', 'Antigüedad10 años', 'Ambientes0', 'Bodegas0', 'Cantidad de pisos0', 'Tipo de casaDúplex', 'OrientaciónNorte', 'Tipo de propiedadCasa sola', 'Mantenimiento0 MXN']",['Superficie total800 m²', 'Superficie construida450 m²', 'Recámaras5', 'Baños5', 'Estacionamientos7', 'Es propiedad en remateNo', 'Antigüedad10 años', 'Ambientes0', 'Bodegas0', 'Cantidad de pisos0', 'Tipo de casaDúplex', 'OrientaciónNorte', 'Tipo de propiedadCasa sola', 'Mantenimiento0 MXN'],,
Casa Cumbres De Lago Juriquilla,9100000,"Residencial El Refugio, Querétaro, QuerétaroVer información de la zona","['Superficie total302 m²', 'Superficie construida463 m²', 'Recámaras4', 'Baños4', 'Estacionamientos3', 'Es propiedad en remateNo', 'Antigüedad9 años', 'Ambientes9', 'Bodegas0', 'Cantidad de pisos0', 'Tipo de casaCasa', 'OrientaciónNorte', 'Mantenimiento0 MXN']",['Superficie total302 m²', 'Superficie construida463 m²', 'Recámaras4', 'Baños4', 'Estacionamientos3', 'Es propiedad en remateNo', 'Antigüedad9 años', 'Ambientes9', 'Bodegas0', 'Cantidad de pisos0', 'Tipo de casaCasa', 'OrientaciónNorte', 'Mantenimiento0 MXN'],,,
"El Refugio. Venta - Casa, 3 Recamaras, Cuarto De Servicio, Roof",3385000,"Corregidora, Querétaro, QuerétaroVer información de la zona","['Superficie total125 m²', 'Superficie construida175 m²', 'Recámaras4', 'Baños5', 'Estacionamientos2', 'Es propiedad en remateNo', 'Antigüedad7 años', 'Bodegas0', 'Tipo de casaCasa', 'Mantenimiento0 MXN']",['Superficie total125 m²', 'Superficie construida175 m²', 'Recámaras4', 'Baños5', 'Estacionamientos2', 'Es propiedad en remateNo', 'Antigüedad7 años', 'Bodegas0', 'Tipo de casaCasa', 'Mantenimiento0 MXN'],,,,,,
Casa En Venta Corregidora 4 Habitaciones Una En Planta Baja,3200000,"Milenio III, Querétaro, QuerétaroVer información de la zona","['Superficie total132 m²', 'Superficie construida161 m²', 'Recámaras4', 'Baños3', 'Estacionamientos0', 'Es propiedad en remateNo', 'Antigüedad1 años', 'Ambientes0', 'Bodegas0', 'Cantidad de pisos2', 'Tipo de casaDúplex', 'OrientaciónNorte', 'Tipo de propiedadCasa sola', 'Mantenimiento0 MXN']",['Superficie total132 m²', 'Superficie construida161 m²', 'Recámaras4', 'Baños3', 'Estacionamientos0', 'Es propiedad en remateNo', 'Antigüedad1 años', 'Ambientes0', 'Bodegas0', 'Cantidad de pisos2', 'Tipo de casaDúplex', 'OrientaciónNorte', 'Tipo de propiedadCasa sola', 'Mantenimiento0 MXN'],,
"¡casa Nueva En Venta En Milenio Iii, Con Baño En Cada Recámara Y Roof Garden!",4750000,"Loma Dorada, Querétaro, QuerétaroVer información de la zona","['Superficie total162 m²', 'Superficie construida212 m²', 'Recámaras3', 'Baños4', 'Estacionamientos0', 'Es propiedad en remateNo', 'Antigüedad0 años', 'Ambientes0', 'Bodegas0', 'Cantidad de pisos3', 'Tipo de casaDúplex', 'OrientaciónNorte', 'Tipo de propiedadCasa sola', 'Mantenimiento0 MXN']",['Superficie total162 m²', 'Superficie construida212 m²', 'Recámaras3', 'Baños4', 'Estacionamientos0', 'Es propiedad en remateNo', 'Antigüedad0 años', 'Ambientes0', 'Bodegas0', 'Cantidad de pisos3', 'Tipo de casaDúplex', 'OrientaciónNorte', 'Tipo de propiedadCasa sola', 'Mantenimiento0 MXN'],,
Casa Venta Santiago De Queretaro,25000000,"Juriquilla, Querétaro, Querétaro","['Superficie total450 m²', 'Superficie construida450 m²', 'Recámaras3', 'Baños3', 'Estacionamientos6', 'Es propiedad en remateNo', 'Antigüedad0 años', 'Ambientes7', 'Bodegas0', 'Mantenimiento0 MXN']",['Superficie total450 m²', 'Superficie construida450 m²', 'Recámaras3', 'Baños3', 'Estacionamientos6', 'Es propiedad en remateNo', 'Antigüedad0 años', 'Ambientes7', 'Bodegas0', 'Mantenimiento0 MXN'],,,,,,
Casa En Venta Bio Grand Juriquilla Queretaro,2835000,"Cumbres Del Lago, Querétaro, QuerétaroVer información de la zona","['Superficie total146 m²', 'Superficie construida143 m²', 'Recámaras3', 'Baños2', 'Estacionamientos2', 'Es propiedad en remateNo', 'Antigüedad0 años', 'Ambientes6', 'Bodegas0', 'Cantidad de pisos0', 'Tipo de casaCasa', 'OrientaciónNorte', 'Mantenimiento0 MXN']",['Superficie total146 m²', 'Superficie construida143 m²', 'Recámaras3', 'Baños2', 'Estacionamientos2', 'Es propiedad en remateNo', 'Antigüedad0 años', 'Ambientes6', 'Bodegas0', 'Cantidad de pisos0', 'Tipo de casaCasa', 'OrientaciónNorte', 'Mantenimiento0 MXN'],,,
Casa Venta Juriquilla Cumbres Del Lago,8440000,"Juriquilla, Querétaro, QuerétaroVer información de la zona","['Superficie total315 m²', 'Superficie construida440 m²', 'Recámaras3', 'Baños5', 'Estacionamientos4', 'Es propiedad en remateNo', 'Antigüedad5 años', 'Ambientes9', 'Bodegas0', 'Cantidad de pisos0', 'Tipo de casaCasa', 'OrientaciónNorte', 'Mantenimiento0 MXN']",['Superficie total315 m²', 'Superficie construida440 m²', 'Recámaras3', 'Baños5', 'Estacionamientos4', 'Es propiedad en remateNo', 'Antigüedad5 años', 'Ambientes9', 'Bodegas0', 'Cantidad de pisos0', 'Tipo de casaCasa', 'OrientaciónNorte', 'Mantenimiento0 MXN'],,,
Casa En Fraccionamiento Privado Colinas De Juriquillaca,5800000,"Paseos Del Pedregal, Querétaro, QuerétaroVer información de la zona","['Superficie total225 m²', 'Superficie construida0 m²', 'Recámaras3', 'Baños4', 'Estacionamientos0', 'Es propiedad en remateNo', 'Antigüedad0 años', 'Ambientes0', 'Bodegas0', 'Cantidad de pisos3', 'Tipo de casaDúplex', 'OrientaciónNorte', 'Tipo de propiedadCasa sola', 'Mantenimiento0 MXN']",['Superficie total225 m²', 'Superficie construida0 m²', 'Recámaras3', 'Baños4', 'Estacionamientos0', 'Es propiedad en remateNo', 'Antigüedad0 años', 'Ambientes0', 'Bodegas0', 'Cantidad de pisos3', 'Tipo de casaDúplex', 'OrientaciónNorte', 'Tipo de propiedadCasa sola', 'Mantenimiento0 MXN'],,
Casa Pre-venta Altozano,12950000,"Loma Dorada, Querétaro, QuerétaroVer información de la zona","['Superficie total272 m²', 'Superficie construida409 m²', 'Recámaras4', 'Baños4', 'Estacionamientos3', 'Es propiedad en remateNo', 'Antigüedad0 años', 'Ambientes9', 'Bodegas0', 'Cantidad de pisos0', 'Tipo de casaCasa', 'OrientaciónNorte', 'Mantenimiento0 MXN']",['Superficie total272 m²', 'Superficie construida409 m²', 'Recámaras4', 'Baños4', 'Estacionamientos3', 'Es propiedad en remateNo', 'Antigüedad0 años', 'Ambientes9', 'Bodegas0', 'Cantidad de pisos0', 'Tipo de casaCasa', 'OrientaciónNorte', 'Mantenimiento0 MXN'],,,
Casa En Venta Loma Dorada  Querétaro Cerca De Los Arcos,12800000,"Av. La Rica, Juriquilla, Querétaro, QuerétaroVer información de la zona","['Superficie total590 m²', 'Superficie construida360 m²', 'Recámaras5', 'Baños4', 'Estacionamientos4', 'Es propiedad en remateNo', 'Antigüedad11 años', 'Ambientes10', 'Bodegas0', 'Cantidad de pisos0', 'Tipo de casaCasa', 'OrientaciónNorte', 'Mantenimiento0 MXN']",['Superficie total590 m²', 'Superficie construida360 m²', 'Recámaras5', 'Baños4', 'Estacionamientos4', 'Es propiedad en remateNo', 'Antigüedad11 años', 'Ambientes10', 'Bodegas0', 'Cantidad de pisos0', 'Tipo de casaCasa', 'OrientaciónNorte', 'Mantenimiento0 MXN'],,,
Casa De Una Planta En Venta 1000 Metros De Terreno En Juriquilla Villas Del Mesón,9300000,"Cumbres Del Lago, Cumbres Del Lago, Querétaro, Querétaro","['Superficie total1,000 m²', 'Superficie construida350 m²', 'Recámaras3', 'Baños3', 'Estacionamientos0', 'Es propiedad en remateNo', 'Antigüedad15 años', 'Ambientes0', 'Bodegas0', 'Cantidad de pisos0', 'Tipo de casaDúplex', 'OrientaciónNorte', 'Tipo de propiedadCasa sola', 'Mantenimiento0 MXN']",['Superficie total1,000 m²', 'Superficie construida350 m²', 'Recámaras3', 'Baños3', 'Estacionamientos0', 'Es propiedad en remateNo', 'Antigüedad15 años', 'Ambientes0', 'Bodegas0', 'Cantidad de pisos0', 'Tipo de casaDúplex', 'OrientaciónNorte', 'Tipo de propiedadCasa sola', 'Mantenimiento0 MXN'],
Casa En Venta Con Jardín De Más De 80 Metros En Cumbres Del Lago Juriquilla,5950000,"El Campanario, Querétaro, QuerétaroVer información de la zona","['Superficie total280 m²', 'Superficie construida254 m²', 'Recámaras3', 'Baños4', 'Estacionamientos0', 'Es propiedad en remateNo', 'Antigüedad7 años', 'Ambientes0', 'Bodegas0', 'Cantidad de pisos0', 'Tipo de casaDúplex', 'OrientaciónNorte', 'Tipo de propiedadCasa sola', 'Mantenimiento0 MXN']",['Superficie total280 m²', 'Superficie construida254 m²', 'Recámaras3', 'Baños4', 'Estacionamientos0', 'Es propiedad en remateNo', 'Antigüedad7 años', 'Ambientes0', 'Bodegas0', 'Cantidad de pisos0', 'Tipo de casaDúplex', 'OrientaciónNorte', 'Tipo de propiedadCasa sola', 'Mantenimiento0 MXN'],,
Casa En Venta En Colonia Cipreses A 8 Min De Hi - Lex Mexicana (av Peñuelas) 25-2085lp~,28600000,"Juan Rulfo 1851, Sonterra Residencial, Querétaro, Querétaro","['Superficie total1,250 m²', 'Superficie construida650 m²', 'Recámaras4', 'Baños6', 'Estacionamientos6', 'Es propiedad en remateNo', 'Antigüedad23 años', 'Bodegas0', 'Tipo de casaCasa', 'Mantenimiento0 MXN']",['Superficie total1,250 m²', 'Superficie construida650 m²', 'Recámaras4', 'Baños6', 'Estacionamientos6', 'Es propiedad en remateNo', 'Antigüedad23 años', 'Bodegas0', 'Tipo de casaCasa', 'Mantenimiento0 MXN'],,,,,
Aprovecha Casa Remato En Fracc. Juan Rulfo Querétaro Posesión Ante Notario Público Ojac-a-505,1350000,"Querétaro, Querétaro","['Superficie total110 m²', 'Superficie construida58 m²', 'Recámaras2', 'Baños1', 'Estacionamientos2', 'Es propiedad en remateNo', 'Antigüedad24 años', 'Cantidad de pisos2', 'Tipo de casaCasa']",['Superficie total110 m²', 'Superficie construida58 m²', 'Recámaras2', 'Baños1', 'Estacionamientos2', 'Es propiedad en remateNo', 'Antigüedad24 años', 'Cantidad de pisos2', 'Tipo de casaCasa'],,,,,,,
"Remato Casa En Querétaro, Gran Oportunidad.",1312167,"Bosques Del Acueducto, Querétaro, QuerétaroVer información de la zona","['Superficie total110 m²', 'Superficie construida180 m²', 'Recámaras3', 'Baños2', 'Estacionamientos2', 'Es propiedad en remateSí', 'Antigüedad8 años', 'Ambientes0', 'Bodegas0', 'Cantidad de pisos2', 'Tipo de casaCasa', 'OrientaciónNorte', 'Mantenimiento1 MXN']",['Superficie total110 m²', 'Superficie construida180 m²', 'Recámaras3', 'Baños2', 'Estacionamientos2', 'Es propiedad en remateSí', 'Antigüedad8 años', 'Ambientes0', 'Bodegas0', 'Cantidad de pisos2', 'Tipo de casaCasa', 'OrientaciónNorte', 'Mantenimiento1 MXN'],,,
"Casa En Venta En Querétaro, De Una Planta, Cerca De Los Arcos",1550000,"Residencial La Vista, La Vista Residencial, Querétaro, QuerétaroVer información de la zona","['Superficie total133 m²', 'Superficie construida87 m²', 'Recámaras2', 'Baños3', 'Estacionamientos2', 'Es propiedad en remateNo', 'Antigüedad8 años', 'Bodegas0', 'Tipo de casaCasa', 'Mantenimiento800 MXN']",['Superficie total133 m²', 'Superficie construida87 m²', 'Recámaras2', 'Baños3', 'Estacionamientos2', 'Es propiedad en remateNo', 'Antigüedad8 años', 'Bodegas0', 'Tipo de casaCasa', 'Mantenimiento800 MXN'],,,,,,
"Casa En Venta En La Vista Residencial, El Refugio Queretaro",10700000,"Sonterra Residencial, Querétaro, Querétaro","['Superficie total408 m²', 'Superficie construida535 m²', 'Recámaras4', 'Baños4', 'Estacionamientos4', 'Es propiedad en remateNo', 'Antigüedad0 años', 'Ambientes9', 'Bodegas0', 'Cantidad de pisos0', 'Tipo de casaCasa', 'OrientaciónNorte', 'Mantenimiento0 MXN']",['Superficie total408 m²', 'Superficie construida535 m²', 'Recámaras4', 'Baños4', 'Estacionamientos4', 'Es propiedad en remateNo', 'Antigüedad0 años', 'Ambientes9', 'Bodegas0', 'Cantidad de pisos0', 'Tipo de casaCasa', 'OrientaciónNorte', 'Mantenimiento0 MXN'],,,
"Casa En Venta, A La Entrada De Sonterra , Querétaro",945000,"El Nuevo Refugio, Querétaro, QuerétaroVer información de la zona","['Superficie total280 m²', 'Superficie construida280 m²', 'Recámaras4', 'Baños3', 'Estacionamientos2', 'Es propiedad en remateSí', 'Tipo de casaCasa']",['Superficie total280 m²', 'Superficie construida280 m²', 'Recámaras4', 'Baños3', 'Estacionamientos2', 'Es propiedad en remateSí', 'Tipo de casaCasa'],,,,,,,,,
"El Nuevo Refugio - Casa De 4 Recamaras Con 1 En Planta Baja, Venta",6000000,"Prudencia Griffel, La Joya, Querétaro, QuerétaroVer información de la zona","['Superficie total250 m²', 'Superficie construida243.02 m²', 'Recámaras5', 'Baños5', 'Estacionamientos0', 'Es propiedad en remateNo', 'Antigüedad1 años', 'Ambientes0', 'Bodegas0', 'Cantidad de pisos0', 'Tipo de casaDúplex', 'OrientaciónNorte', 'Tipo de propiedadCasa sola', 'Mantenimiento0 MXN']",['Superficie total250 m²', 'Superficie construida243.02 m²', 'Recámaras5', 'Baños5', 'Estacionamientos0', 'Es propiedad en remateNo', 'Antigüedad1 años', 'Ambientes0', 'Bodegas0', 'Cantidad de pisos0', 'Tipo de casaDúplex', 'OrientaciónNorte', 'Tipo de propiedadCasa sola', 'Mantenimiento0 MXN'],,
C3 Casa En Venta La Joya Queretaro Cesion De Derechos Adjudicatarios,5200000,"Lago Patzcuaro 712, Cumbres Del Lago, Querétaro, QuerétaroVer información de la zona","['Superficie total180 m²', 'Superficie construida215 m²', 'Recámaras3', 'Baños3', 'Estacionamientos2', 'Es propiedad en remateNo', 'Antigüedad0 años', 'Bodegas1', 'Cantidad de pisos2', 'Tipo de casaCasa', 'Mantenimiento1,300 MXN']",['Superficie total180 m²', 'Superficie construida215 m²', 'Recámaras3', 'Baños3', 'Estacionamientos2', 'Es propiedad en remateNo', 'Antigüedad0 años', 'Bodegas1', 'Cantidad de pisos2', 'Tipo de casaCasa', 'Mantenimiento1,300 MXN'],,,,
C3 Casa En Venta Santa Rosa De Jauregui Juriquilla,1900000,"Balcones Del Acueducto, Querétaro, QuerétaroVer información de la zona","['Superficie total153 m²', 'Superficie construida111 m²', 'Recámaras3', 'Baños2', 'Estacionamientos0', 'Es propiedad en remateNo', 'Antigüedad0 años', 'Ambientes0', 'Bodegas0', 'Cantidad de pisos2', 'Tipo de casaDúplex', 'OrientaciónNorte', 'Tipo de propiedadCasa sola', 'Mantenimiento0 MXN']",['Superficie total153 m²', 'Superficie construida111 m²', 'Recámaras3', 'Baños2', 'Estacionamientos0', 'Es propiedad en remateNo', 'Antigüedad0 años', 'Ambientes0', 'Bodegas0', 'Cantidad de pisos2', 'Tipo de casaDúplex', 'OrientaciónNorte', 'Tipo de propiedadCasa sola', 'Mantenimiento0 MXN'],,
"Balcones Del Acueducto. Casa, 3 Recamaras, Cuarto De Servicio - Venta",5450000,"Villas Del Mesón, Querétaro, QuerétaroVer información de la zona","['Superficie total183 m²', 'Superficie construida203 m²', 'Recámaras4', 'Baños3', 'Estacionamientos2', 'Es propiedad en remateNo', 'Antigüedad1 años', 'Bodegas0', 'Tipo de casaCasa', 'Mantenimiento0 MXN']",['Superficie total183 m²', 'Superficie construida203 m²', 'Recámaras4', 'Baños3', 'Estacionamientos2', 'Es propiedad en remateNo', 'Antigüedad1 años', 'Bodegas0', 'Tipo de casaCasa', 'Mantenimiento0 MXN'],,,,,,
Rcv Casa Venta  Juriquilla Villas Del Mesón,1199000,"Av. Los Portones 1027, Valle de Juriquilla, Querétaro, QuerétaroVer información de la zona","['Superficie total114 m²', 'Superficie construida179 m²', 'Recámaras3', 'Baños2', 'Estacionamientos1', 'Es propiedad en remateSí', 'Antigüedad14 años', 'Ambientes2', 'Bodegas1', 'Cantidad de pisos2', 'Tipo de casaCasa', 'Mantenimiento1 MXN']",['Superficie total114 m²', 'Superficie construida179 m²', 'Recámaras3', 'Baños2', 'Estacionamientos1', 'Es propiedad en remateSí', 'Antigüedad14 años', 'Ambientes2', 'Bodegas1', 'Cantidad de pisos2', 'Tipo de casaCasa', 'Mantenimiento1 MXN'],,,,
"Casa En Venta En Valle De Juriquilla Queretaro, Muy Cerca De Heb A 10 Minutos De Uvm Y Unam",3400000,"Residencial La Vista, La Vista Residencial, Querétaro, QuerétaroVer información de la zona","['Superficie total317 m²', 'Superficie construida305 m²', 'Recámaras4', 'Baños3', 'Estacionamientos2', 'Es propiedad en remateSí', 'Antigüedad10 años', 'Ambientes3', 'Bodegas1', 'Cantidad de pisos2', 'OrientaciónNorte', 'Mantenimiento1 MXN']",['Superficie total317 m²', 'Superficie construida305 m²', 'Recámaras4', 'Baños3', 'Estacionamientos2', 'Es propiedad en remateSí', 'Antigüedad10 años', 'Ambientes3', 'Bodegas1', 'Cantidad de pisos2', 'OrientaciónNorte', 'Mantenimiento1 MXN'],,,,
Casa En Venta En La Vista Residencial El Marques Queretaro,8000000,"Juriquilla, Querétaro, Querétaro","['Superficie total325 m²', 'Superficie construida355 m²', 'Recámaras4', 'Baños5', 'Estacionamientos3', 'Es propiedad en remateNo', 'Antigüedad13 años', 'Bodegas1', 'Tipo de casaCasa', 'Mantenimiento0 MXN']",['Superficie total325 m²', 'Superficie construida355 m²', 'Recámaras4', 'Baños5', 'Estacionamientos3', 'Es propiedad en remateNo', 'Antigüedad13 años', 'Bodegas1', 'Tipo de casaCasa', 'Mantenimiento0 MXN'],,,,,,
Casa Venta Juriquilla San Isidro-ziburua,8900000,"Corregidora, Querétaro, QuerétaroVer información de la zona","['Superficie total1,000 m²', 'Superficie construida320 m²', 'Recámaras3', 'Baños3', 'Estacionamientos4', 'Es propiedad en remateNo', 'Antigüedad21 años', 'Ambientes7', 'Bodegas0', 'Cantidad de pisos0', 'Tipo de casaCasa', 'OrientaciónNorte', 'Mantenimiento0 MXN']",['Superficie total1,000 m²', 'Superficie construida320 m²', 'Recámaras3', 'Baños3', 'Estacionamientos4', 'Es propiedad en remateNo', 'Antigüedad21 años', 'Ambientes7', 'Bodegas0', 'Cantidad de pisos0', 'Tipo de casaCasa', 'OrientaciónNorte', 'Mantenimiento0 MXN'],,
Casa En Venta En Paseos Del Bosque,5730000,"Cumbres Del Lago, Querétaro, Querétaro","['Superficie total180 m²', 'Superficie construida260 m²', 'Recámaras3', 'Baños3', 'Estacionamientos3', 'Es propiedad en remateNo', 'Antigüedad0 años', 'Ambientes4', 'Bodegas1', 'Cantidad de pisos3', 'Tipo de casaCasa', 'OrientaciónOriente', 'Mantenimiento950 MXN']",['Superficie total180 m²', 'Superficie construida260 m²', 'Recámaras3', 'Baños3', 'Estacionamientos3', 'Es propiedad en remateNo', 'Antigüedad0 años', 'Ambientes4', 'Bodegas1', 'Cantidad de pisos3', 'Tipo de casaCasa', 'OrientaciónOriente', 'Mantenimiento950 MXN'],,,
"Venta. Cumbres Del Lago - Casa Segunda Mano, Cuarto De Tv 3 Recamaras ",4800000,"Juriquilla, Querétaro, QuerétaroVer información de la zona","['Superficie total145 m²', 'Superficie construida197 m²', 'Recámaras4', 'Baños4', 'Estacionamientos2', 'Es propiedad en remateNo', 'Antigüedad0 años', 'Ambientes5', 'Bodegas1', 'Cantidad de pisos3', 'Tipo de casaCasa', 'OrientaciónPoniente', 'Mantenimiento1,300 MXN']",['Superficie total145 m²', 'Superficie construida197 m²', 'Recámaras4', 'Baños4', 'Estacionamientos2', 'Es propiedad en remateNo', 'Antigüedad0 años', 'Ambientes5', 'Bodegas1', 'Cantidad de pisos3', 'Tipo de casaCasa', 'OrientaciónPoniente', 'Mantenimiento1,300 MXN'],,
