,House,Price,Ubication,Features
0,Casa En Renta En La Vista,"3,300,000","La Vista Residencial, Querétaro, QuerétaroVer información de la zona",[]
1,Vendo Casa En Calle Barroco Queretaro,"1,701,770","Barroco 9, Corregidora, Querétaro, QuerétaroVer información de la zona","['Superficie total90 m²', 'Superficie construida90 m²', 'Recámaras3', 'Baños2', 'Estacionamientos2', 'Es propiedad en remateSí', 'Antigüedad10 años', 'Ambientes1', 'Bodegas0', 'Cantidad de pisos2', 'Tipo de casaCasa', 'OrientaciónNorte', 'Mantenimiento1 MXN']"
2,Casa Tipo Colonial Mexicano! Recámara Principal En Planta Baja! Villas Del Mesón Juriquilla!,"7,450,000","Juriquilla, Querétaro, QuerétaroVer información de la zona","['Superficie total434 m²', 'Superficie construida376.25 m²', 'Recámaras3', 'Baños3', 'Estacionamientos0', 'Es propiedad en remateNo', 'Antigüedad1 años', 'Ambientes0', 'Bodegas0', 'Cantidad de pisos2', 'Tipo de casaDúplex', 'OrientaciónNorte', 'Tipo de propiedadCasa sola', 'Mantenimiento0 MXN']"
3,"Casa Colonial En El Corazón De Juriquilla 5 Recámaras Completas, Una En Planta Baja...","8,999,000","Juriquilla, Querétaro, QuerétaroVer información de la zona","['Superficie total468 m²', 'Superficie construida400 m²', 'Recámaras5', 'Baños4', 'Estacionamientos0', 'Es propiedad en remateNo', 'Antigüedad1 años', 'Ambientes0', 'Bodegas0', 'Cantidad de pisos2', 'Tipo de casaDúplex', 'OrientaciónNorte', 'Tipo de propiedadCasa sola', 'Mantenimiento0 MXN']"
4,"Remato Casa En: Prolongación Hacienda La Venta 3, San José, Querétaro, Querétaro.","838,600","Prolongación Hacienda La Venta 3, San José, Querétaro, QuerétaroVer información de la zona","['Superficie total156 m²', 'Superficie construida156 m²', 'Recámaras3', 'Baños2', 'Estacionamientos2', 'Es propiedad en remateSí', 'Antigüedad20 años', 'Ambientes10', 'Bodegas0', 'Cantidad de pisos2', 'Tipo de casaCasa', 'OrientaciónNorte']"
5,Real De Juriquilla Casa De 2 Recamaras En Venta Rah1704,"4,600,000","Cascada De Agua Azul 103, 76226 Juriquilla, Qro., Mexico, Real De Juriquilla, Querétaro, Querétaro","['Superficie total256 m²', 'Superficie construida193 m²', 'Recámaras2', 'Baños3', 'Estacionamientos2', 'Es propiedad en remateNo', 'Antigüedad10 años', 'Cantidad de pisos2', 'Tipo de casaCasa', 'Mantenimiento400 MXN']"
6,Casa En Venta En San Isidro Juriquilla,"3,100,000","Circuito Pizzarra 592, Otros, Querétaro, Querétaro","['Superficie total142.02 m²', 'Superficie construida156 m²', 'Recámaras3', 'Baños2', 'Estacionamientos2', 'Es propiedad en remateNo', 'Antigüedad1 años', 'Ambientes5', 'Bodegas0', 'Cantidad de pisos2', 'Tipo de casaCasa', 'OrientaciónOriente', 'Mantenimiento900 MXN']"
7,"Casa De Recuperación Bancaria Adjudicada En Calle Volcán, Cond. Fracc. Ciudad Satélite, Querétaro. ¡no Créditos!","1,325,200","Fuente De Creta, Santa Ana, Santiago De Querétaro, Satélite, Querétaro, QuerétaroVer información de la zona","['Superficie total163 m²', 'Superficie construida76 m²', 'Recámaras2', 'Baños2', 'Estacionamientos2', 'Es propiedad en remateSí', 'Antigüedad2,013 años', 'Ambientes0', 'Bodegas0', 'Cantidad de pisos2', 'Tipo de casaCasa', 'OrientaciónPoniente', 'Mantenimiento1 MXN']"
8,Casa En Venta En Zaru Queretaro,"3,365,000","El Marques, Querétaro, QuerétaroVer información de la zona","['Superficie total108 m²', 'Superficie construida155 m²', 'Recámaras3', 'Baños2', 'Estacionamientos2', 'Es propiedad en remateNo', 'Antigüedad0 años', 'Ambientes6', 'Bodegas0', 'Mantenimiento0 MXN']"
9,Casa Barata En El Tintero Queretaro. Maf,"1,199,000","C. Literatura 1 - 300, Ex-Hacienda El Tintero, Querétaro, QuerétaroVer información de la zona","['Superficie total126 m²', 'Superficie construida120 m²', 'Recámaras3', 'Baños1', 'Estacionamientos1', 'Es propiedad en remateSí', 'Antigüedad10 años', 'Ambientes8', 'Bodegas0', 'Cantidad de pisos2', 'Tipo de casaCasa', 'OrientaciónPoniente', 'Mantenimiento1,200 MXN']"
10,¡¡¡excelente Oportunidad De Inversion En Queretaro!!!,"1,830,000","Paseo De Libero, Caletto, Querétaro, QuerétaroVer información de la zona","['Superficie total600 m²', 'Superficie construida300 m²', 'Recámaras3', 'Baños2', 'Estacionamientos2', 'Es propiedad en remateSí', 'Antigüedad8 años', 'Ambientes0', 'Bodegas0', 'Cantidad de pisos2', 'Tipo de casaCasa', 'OrientaciónNorte', 'Mantenimiento1 MXN']"
11,"Inversión Segura, Venta De Remate En Real De Juriquilla Querétaro, Qro._rx","5,625,000","Real De Juriquilla, Juriquilla, Qro., México, Real De Juriquilla, Querétaro, Querétaro","['Superficie total300 m²', 'Superficie construida325 m²', 'Recámaras3', 'Baños4', 'Estacionamientos3', 'Es propiedad en remateSí', 'Antigüedad5 años', 'Ambientes5', 'Bodegas0', 'Cantidad de pisos2', 'Tipo de casaCasa', 'OrientaciónNorte']"
12," Casa En Venta Querétaro, Juriquilla San Isidro Ag*","1,850,000","Circuito Pizarra 622, San Isidro Juriquilla, Querétaro, Querétaro","['Superficie total198 m²', 'Superficie construida119 m²', 'Recámaras3', 'Baños3', 'Estacionamientos2', 'Es propiedad en remateSí', 'Antigüedad18 años', 'Ambientes0', 'Bodegas0', 'Cantidad de pisos2', 'Tipo de casaCasa', 'OrientaciónOriente', 'Mantenimiento500 MXN']"
13,"Inversión Segura, Venta De Remate En Loma De San Gremal Milenio Iii, Queretaro_rx","6,635,047","Milenio Iii, Santiago De Querétaro, Querétaro, México, Milenio III, Querétaro, QuerétaroVer información de la zona","['Superficie total620 m²', 'Superficie construida440 m²', 'Recámaras4', 'Baños4', 'Estacionamientos3', 'Es propiedad en remateSí', 'Antigüedad5 años', 'Ambientes7', 'Bodegas0', 'Cantidad de pisos2', 'Tipo de casaCasa', 'OrientaciónNorte']"
14,Casa En Remate Bancario En Querétaro Mm/,"3,300,000","Cerro De Pathé, Las Américas, Querétaro, QuerétaroVer información de la zona","['Superficie total107 m²', 'Superficie construida204 m²', 'Recámaras3', 'Baños2', 'Estacionamientos1', 'Es propiedad en remateSí', 'Antigüedad18 años', 'Ambientes0', 'Bodegas0', 'Cantidad de pisos2', 'Tipo de casaCasa', 'OrientaciónSur', 'Mantenimiento0 MXN']"
15,Cómoda Y Acogedora Casa Oportunidad Milenio Iii Santiago De Queretaro Queretaro México Gj-rl A,"987,000","Senda Del Rocío, Milenio III, Querétaro, QuerétaroVer información de la zona","['Superficie total140 m²', 'Superficie construida183 m²', 'Recámaras3', 'Baños3', 'Estacionamientos2', 'Es propiedad en remateNo', 'Antigüedad18 años', 'Ambientes5', 'Bodegas0', 'Cantidad de pisos2', 'Tipo de casaCasa', 'OrientaciónPoniente', 'Mantenimiento1 MXN']"
16,Estupenda Y Acogedora Casa Milenio Lll Santiago De  Querétaro Queretaro México Gj-rl A,"895,000","Senda Inmortal, Milenio III, Querétaro, QuerétaroVer información de la zona","['Superficie total230 m²', 'Superficie construida250 m²', 'Recámaras3', 'Baños3', 'Estacionamientos2', 'Es propiedad en remateNo', 'Antigüedad18 años', 'Ambientes5', 'Bodegas0', 'Cantidad de pisos2', 'Tipo de casaCasa', 'OrientaciónPoniente', 'Mantenimiento1 MXN']"
17,Casa En Queretaro Gran Oportunidad,"980,000","Barroco 9, Candiles, Querétaro, QuerétaroVer información de la zona","['Superficie total90 m²', 'Superficie construida90 m²', 'Recámaras3', 'Baños2', 'Estacionamientos2', 'Es propiedad en remateSí', 'Antigüedad10 años', 'Ambientes0', 'Bodegas0', 'Cantidad de pisos2', 'Tipo de casaCasa', 'OrientaciónSur']"
18,"Casa En Venta Marqués De La Villa Del Villar Del Aguila 1961, Centro Sur, 76090 Santiago De Querétaro, Querétaro","800,000","Marqués De La Villa Del Villar Del Aguila 1961, Centro Sur, Querétaro, QuerétaroVer información de la zona","['Superficie total175 m²', 'Superficie construida175 m²', 'Recámaras3', 'Baños2', 'Estacionamientos2', 'Es propiedad en remateSí', 'Antigüedad10 años', 'Ambientes0', 'Bodegas0', 'Cantidad de pisos2', 'Tipo de casaCasa', 'OrientaciónSur', 'Mantenimiento1,500 MXN']"
19,"Venta. Casa De Un Piso, Area De Tv, 3 Recamaras - Huertas La Joya","3,950,000","Huertas La Joya, Querétaro, QuerétaroVer información de la zona","['Superficie total360 m²', 'Superficie construida200 m²', 'Recámaras3', 'Baños3', 'Estacionamientos3', 'Es propiedad en remateNo', 'Antigüedad4 años', 'Bodegas1', 'Tipo de casaCasa', 'Mantenimiento0 MXN']"
20,Vendo Casa En Santiago De Queretaro Cerca De Centro Universitario Bra ,"850,000","Santiago De Querétaro, Querétaro, México, Santiago, Querétaro, QuerétaroVer información de la zona","['Superficie total360 m²', 'Superficie construida360 m²', 'Recámaras4', 'Baños4', 'Estacionamientos3', 'Es propiedad en remateSí', 'Antigüedad15 años', 'Ambientes0', 'Bodegas0', 'Cantidad de pisos2', 'Tipo de casaCasa', 'OrientaciónPoniente', 'Mantenimiento0 MXN']"
21,"Casa En Venta En Av. Mirador De Las Ranas 65, 76209 Santiago De Querétaro, Qro. Cmr.","1,250,000","Rinconada Del Pedregal, Querétaro, México, Rinconada Del Sol, Querétaro, QuerétaroVer información de la zona","['Superficie total123 m²', 'Superficie construida123 m²', 'Recámaras3', 'Baños1', 'Estacionamientos2', 'Es propiedad en remateSí', 'Antigüedad5 años', 'Ambientes0', 'Bodegas0', 'Cantidad de pisos2', 'Tipo de casaCasa', 'OrientaciónNorte', 'Mantenimiento0 MXN']"
22,Rcv Casa Pre Venta La Vista Residencial,"3,800,000","La Vista Residencial, Querétaro, QuerétaroVer información de la zona","['Superficie total145 m²', 'Superficie construida151 m²', 'Recámaras3', 'Baños3', 'Estacionamientos2', 'Es propiedad en remateNo', 'Antigüedad0 años', 'Ambientes7', 'Bodegas0', 'Cantidad de pisos0', 'Tipo de casaCasa', 'OrientaciónNorte', 'Mantenimiento0 MXN']"
23,Hermosa Casa Con Espacios Amplios Y Vista Panoramica A La Ciudad,"7,600,000","C. Maciso Tibesti 422, Santiago, Querétaro, QuerétaroVer información de la zona","['Superficie total240 m²', 'Superficie construida343 m²', 'Recámaras4', 'Baños4', 'Estacionamientos0', 'Es propiedad en remateNo', 'Antigüedad0 años', 'Ambientes0', 'Bodegas0', 'Cantidad de pisos3', 'Tipo de casaDúplex', 'OrientaciónNorte', 'Tipo de propiedadCasa sola', 'Mantenimiento0 MXN']"
24,Casa En Venta De Recuperacion Bancaria En Maciso Tibesti. Laab1,"600,000","Sierra Morena, Loma Ix, San Pedro Martir, Loma IX, Querétaro, QuerétaroVer información de la zona","['Superficie total110 m²', 'Superficie construida170 m²', 'Recámaras3', 'Baños2', 'Estacionamientos0', 'Es propiedad en remateSí', 'Antigüedad10 años', 'Ambientes1', 'Bodegas1', 'Cantidad de pisos2', 'Tipo de casaCasa', 'OrientaciónNorte', 'Mantenimiento0 MXN']"
25,"Casa De Recuperación Bancaria Adjudicada En Calle Sierra Morena, Cond. Leon, Loma 9, Querétaro. ¡no Créditos!","616,701","Av. De La Cantera 2800-int 35, Ciudad del Sol, Querétaro, QuerétaroVer información de la zona","['Superficie total54 m²', 'Superficie construida47 m²', 'Recámaras1', 'Baños1', 'Estacionamientos1', 'Es propiedad en remateSí', 'Antigüedad2,009 años', 'Ambientes0', 'Bodegas0', 'Cantidad de pisos1', 'Tipo de casaCasa', 'OrientaciónPoniente', 'Mantenimiento100 MXN']"
26,"Excelente Oportunidad, Casa En Venta En Ciudad Del Sol, Queretaro","1,730,000","Loma Linda, Querétaro, México, Loma Linda, Querétaro, Querétaro","['Superficie total129 m²', 'Superficie construida117 m²', 'Recámaras3', 'Baños3', 'Estacionamientos2', 'Es propiedad en remateSí']"
27,"Inversión Segura, Venta De Remate En Loma Linda Queretaro_rx","845,962","Cda. Punta Mita 111, Juriquilla, Juriquilla, Querétaro, QuerétaroVer información de la zona","['Superficie total98 m²', 'Superficie construida98 m²', 'Recámaras3', 'Baños2', 'Estacionamientos1', 'Es propiedad en remateSí', 'Antigüedad18 años', 'Ambientes4', 'Bodegas0', 'Cantidad de pisos1', 'Tipo de casaDúplex', 'OrientaciónPoniente']"
28,"¡¡jb-hermosa Casa En Juriquilla Queretaro, Gran Oportunidad De Remate!!","849,000","Santa Monica 2da Sección, Santa Mónica 2a Secc., Querétaro, QuerétaroVer información de la zona","['Superficie total192 m²', 'Superficie construida192 m²', 'Recámaras3', 'Baños2', 'Estacionamientos2', 'Es propiedad en remateSí', 'Antigüedad7 años', 'Ambientes5', 'Bodegas1', 'Cantidad de pisos2', 'Tipo de casaCasa', 'OrientaciónPoniente', 'Mantenimiento1,000 MXN']"
29,"Venta De Casa En Queretaro , Santa Monica, Queretaro","3,300,000","Sisal, El Refugio Residencial, Querétaro, QuerétaroVer información de la zona","['Superficie total100 m²', 'Superficie construida100 m²', 'Recámaras3', 'Baños2', 'Estacionamientos1', 'Es propiedad en remateSí', 'Antigüedad20 años', 'Ambientes0', 'Bodegas0', 'Cantidad de pisos0', 'Tipo de casaCasa', 'OrientaciónSur']"
30,"Casa En Remate Bancario En Santiago De Querétaro, Querétaro Mm","709,200","Paseo Real 1 - 300, El Refugio Residencial, Querétaro, QuerétaroVer información de la zona","['Superficie total75 m²', 'Superficie construida60 m²', 'Recámaras3', 'Baños1', 'Estacionamientos1', 'Es propiedad en remateSí', 'Antigüedad15 años', 'Ambientes0', 'Bodegas0', 'Cantidad de pisos2', 'Tipo de casaCasa', 'OrientaciónPoniente', 'Mantenimiento0 MXN']"
31,Casa En Venta En El Refugio Querétaro Con Buenos Acabados.,"5,250,000","Misión Mariana, Candiles, Querétaro, QuerétaroVer información de la zona","['Superficie total133.69 m²', 'Superficie construida239.51 m²', 'Recámaras4', 'Baños4', 'Estacionamientos3', 'Es propiedad en remateNo', 'Antigüedad3 años', 'Cantidad de pisos3', 'Tipo de casaCasa']"
32,"Casa De Oportunidad! Colonia Mision Mariana Candiles Queretaro, Pago De Contado!","900,000","Cerro Loreto, Colinas Del Cimatario, Querétaro, QuerétaroVer información de la zona","['Superficie total90 m²', 'Superficie construida90 m²', 'Recámaras3', 'Baños2', 'Estacionamientos2', 'Es propiedad en remateSí', 'Antigüedad20 años', 'Ambientes15', 'Bodegas0', 'Cantidad de pisos2', 'Tipo de casaCasa', 'OrientaciónPoniente', 'Mantenimiento1 MXN']"
33,"Gran Oportunidad Casa En Venta En Cerro Loreto, Colinas Del Cimatario, Santiago De Querétaro, Querétaro, México. Cmr","990,000","Paseos De San Miguel, Querétaro, QuerétaroVer información de la zona","['Superficie total150 m²', 'Superficie construida275 m²', 'Recámaras4', 'Baños3', 'Estacionamientos3', 'Es propiedad en remateSí', 'Antigüedad12 años', 'Ambientes0', 'Bodegas0', 'Cantidad de pisos2', 'Tipo de casaCasa', 'OrientaciónNorte', 'Mantenimiento0 MXN']"
34,"Casa En Venta En Puertas De San Miguel, Queretaro, En Condominio","1,250,000","Milenio III, Querétaro, QuerétaroVer información de la zona","['Superficie total79 m²', 'Superficie construida81 m²', 'Recámaras3', 'Baños1', 'Estacionamientos0', 'Es propiedad en remateNo', 'Antigüedad0 años', 'Ambientes0', 'Bodegas0', 'Cantidad de pisos2', 'Tipo de casaDúplex', 'OrientaciónNorte', 'Tipo de propiedadCasa sola', 'Mantenimiento0 MXN']"
35,Casa En Privada Con Amenidades Y Seguridad En Milenio Iii,"3,200,000","Granada 402, Los Sauces, Querétaro, QuerétaroVer información de la zona","['Superficie total150 m²', 'Superficie construida170 m²', 'Recámaras3', 'Baños2', 'Estacionamientos0', 'Es propiedad en remateNo', 'Antigüedad0 años', 'Ambientes0', 'Bodegas0', 'Cantidad de pisos2', 'Tipo de casaDúplex', 'OrientaciónNorte', 'Tipo de propiedadCasa sola', 'Mantenimiento0 MXN']"
36,Invierte En Tu Futuro Remate Judicial En Los Sauces Queretaro,"1,320,000","Buena Vista, Vista 2000, Querétaro, QuerétaroVer información de la zona","['Superficie total130 m²', 'Superficie construida145 m²', 'Recámaras3', 'Baños2', 'Estacionamientos1', 'Es propiedad en remateSí', 'Antigüedad20 años', 'Ambientes15', 'Bodegas1', 'Cantidad de pisos2']"
37,"Casa De Recuperación Bancaria Adjudicada, En Buenavista, Vista 2000, Santiago De Querétaro. ¡no Créditos!","893,000","Petra De Mallorca 43a, Bosques Del Acueducto, Querétaro, QuerétaroVer información de la zona","['Superficie total125 m²', 'Superficie construida112 m²', 'Recámaras3', 'Baños2', 'Estacionamientos2', 'Es propiedad en remateSí', 'Antigüedad10 años', 'Ambientes5', 'Bodegas0', 'Cantidad de pisos2', 'Tipo de casaCasa', 'OrientaciónSur', 'Mantenimiento500 MXN']"
38,"Casa En Venta, Recuperación Bancaria, Col. Bosques Del Acuaducto, Santiago De Queretaro, Queretaro. Jf08","2,692,579","C. 3 144, Los Comerciantes, Querétaro, QuerétaroVer información de la zona","['Superficie total362 m²', 'Superficie construida444 m²', 'Recámaras4', 'Baños4', 'Estacionamientos3', 'Es propiedad en remateSí', 'Antigüedad24 años', 'Ambientes0', 'Bodegas0', 'Cantidad de pisos2', 'Tipo de casaCasa', 'OrientaciónSur', 'Mantenimiento100 MXN']"
39,"Casa En Remate Bancario En Querétaro, Querétaro M*","500,000","Lago Yalahan 237, Juriquilla Santa Fe, Querétaro, QuerétaroVer información de la zona","['Superficie total280 m²', 'Superficie construida130 m²', 'Recámaras3', 'Baños2', 'Estacionamientos1', 'Es propiedad en remateSí', 'Antigüedad25 años', 'Ambientes0', 'Bodegas0', 'Cantidad de pisos2', 'Tipo de casaCasa', 'OrientaciónNorte', 'Mantenimiento0 MXN']"
40,"Casa En Recuperación Cumbres De Lago, Juriquilla, Queretaro. Kr25","1,412,560","Blvrd De Los Gobernadores 1002-int 1 - 300, Monte Blanco III Cond. III, Querétaro, QuerétaroVer información de la zona","['Superficie total205 m²', 'Superficie construida310 m²', 'Recámaras4', 'Baños3', 'Estacionamientos2', 'Es propiedad en remateSí', 'Antigüedad12 años', 'Ambientes0', 'Bodegas0', 'Cantidad de pisos1', 'Tipo de casaCasa', 'OrientaciónPoniente', 'Mantenimiento0 MXN']"
41,"Casa De Recuperacion En Venta Fraccionamiento Monte Blanco Iii, Santiago De Queretaro Jf08","2,616,800","Tejeda, Tejeda, Querétaro, QuerétaroVer información de la zona","['Superficie total222.35 m²', 'Superficie construida108.2 m²', 'Recámaras3', 'Baños3', 'Estacionamientos2', 'Es propiedad en remateSí', 'Antigüedad15 años', 'Ambientes0', 'Bodegas0', 'Cantidad de pisos2', 'Tipo de casaCasa', 'OrientaciónSur', 'Mantenimiento100 MXN']"
42,"Gran Oportunidad De Inversion -casa En El Pueblito, Queretaro /crg","1,302,000","Campestre Huertas la Joya, Querétaro, QuerétaroVer información de la zona","['Superficie total180 m²', 'Superficie construida210 m²', 'Recámaras3', 'Baños2', 'Estacionamientos2', 'Es propiedad en remateSí', 'Antigüedad12 años', 'Ambientes0', 'Bodegas0', 'Cantidad de pisos2', 'Tipo de casaCasa', 'OrientaciónOriente', 'Mantenimiento0 MXN']"
43,Casa Venta Huertas La Joya,"29,500,000","Cto Del Sol 1 - 300, Candiles, Querétaro, QuerétaroVer información de la zona","['Superficie total19,000 m²', 'Superficie construida3,229 m²', 'Recámaras3', 'Baños4', 'Estacionamientos0', 'Es propiedad en remateNo', 'Antigüedad0 años', 'Ambientes7', 'Bodegas0', 'Cantidad de pisos0', 'Tipo de casaCasa', 'OrientaciónNorte', 'Mantenimiento0 MXN']"
44,"Casa En Venta, Recuperación Bancaria, Col. Colinas Del Sol, Candiles, Queretaro. Jf08","758,342","C. Fuerte De Coín 1 - 300, El Vergel, Querétaro, QuerétaroVer información de la zona","['Superficie total68 m²', 'Superficie construida70 m²', 'Recámaras2', 'Baños2', 'Estacionamientos1', 'Es propiedad en remateSí', 'Antigüedad24 años', 'Ambientes0', 'Bodegas0', 'Cantidad de pisos2', 'Tipo de casaCasa', 'OrientaciónSur', 'Mantenimiento100 MXN']"
45,Sk05- Casas En Remates Bancarios Calle Fuerte De Coin Fracc Vergel Queretaro,"375,262","Querétaro, QuerétaroVer información de la zona","['Superficie total75 m²', 'Superficie construida90 m²', 'Recámaras1', 'Baños1', 'Estacionamientos1', 'Es propiedad en remateSí', 'Antigüedad12 años', 'Ambientes0', 'Bodegas0', 'Cantidad de pisos1', 'Tipo de casaCasa', 'OrientaciónNorte']"
46,Adquiere Tu Casa Nueva A Solo 12 Min De Plaza Patio 24-1520lp~,"1,350,000","Blvd. Hacienda La Gloria 1701-casa 1 - 300, Residencial Parque La Gloria, Querétaro, QuerétaroVer información de la zona","['Superficie total69 m²', 'Superficie construida66 m²', 'Recámaras2', 'Baños1', 'Estacionamientos1', 'Es propiedad en remateNo', 'Antigüedad1 años', 'Bodegas0', 'Cantidad de pisos2', 'Tipo de casaCasa', 'Mantenimiento500 MXN']"
47,"Casa En Venta, Recuperación Bancaria, Col. Parque La Gloria, Santiago De Queretaro , Queretaro. Jf08","911,920","Portal De San Marcos 527, Villas De Santiago, Santiago De Querétaro, Villas De Santiago, Querétaro, QuerétaroVer información de la zona","['Superficie total158 m²', 'Superficie construida103 m²', 'Recámaras4', 'Baños3', 'Estacionamientos1', 'Es propiedad en remateSí', 'Antigüedad16 años', 'Ambientes0', 'Bodegas0', 'Cantidad de pisos2', 'Tipo de casaCasa', 'OrientaciónSur', 'Mantenimiento100 MXN']"
48,"Casa En Venta, Recuperación Bancaria, Col. Villas De Santiago, Santiago De Queretaro , Queretaro. Jf08","583,275","Cordillera De Los Andes 2156, Colinas Del Poniente, 76116 Santiago De Querétaro, Qro., México, Santiago, Querétaro, QuerétaroVer información de la zona","['Superficie total120 m²', 'Superficie construida152 m²', 'Recámaras3', 'Baños2', 'Estacionamientos1', 'Es propiedad en remateSí', 'Antigüedad10 años', 'Ambientes0', 'Bodegas0', 'Cantidad de pisos2', 'Tipo de casaCasa', 'OrientaciónSur', 'Mantenimiento100 MXN']"
49,"Vendo Casa En Cordillera De Los Andes, Colinas Del Poniente.","2,800,000","Manuel Orozco Y Berra 151, Zona Dos Extendida, Prados Del Mirador, Santiago De Querétaro, Prados Del Mirador, Querétaro, QuerétaroVer información de la zona","['no disponible', 'no disponible']"
50,"Casa En Venta, Recuperación Bancaria, Col. Prados Del Mirador, Santiago De Queretaro, Queretaro. Jf08","667,000","Avenida Equinoccio, Puerta Del Sol II, Querétaro, QuerétaroVer información de la zona","['Superficie total120 m²', 'Superficie construida120 m²', 'Recámaras3', 'Baños2', 'Estacionamientos1', 'Es propiedad en remateSí', 'Antigüedad20 años', 'Ambientes2', 'Bodegas2', 'Cantidad de pisos2', 'Tipo de casaCasa', 'OrientaciónNorte']"
51,"Gran Oportunidad Casa En Venta En Avenida Equinoccio, Puerta Del Sol Ii, Santiago De Querétaro, Querétaro, México. Cmr","1,946,320","Marqués De Cruillas 134, Lomas Del Marques, Santiago De Querétaro, Lomas Del Marques, Querétaro, QuerétaroVer información de la zona","['Superficie total160 m²', 'Superficie construida144 m²', 'Recámaras4', 'Baños3', 'Estacionamientos1', 'Es propiedad en remateSí', 'Antigüedad24 años', 'Ambientes0', 'Bodegas0', 'Cantidad de pisos2', 'Tipo de casaCasa', 'OrientaciónSur', 'Mantenimiento100 MXN']"
52,"Casa En Venta, Recuperación Bancaria, Col. Lomas Del Marques, Santiago De Queretaro, Queretaro. Jf08","670,000","Alamos 3ra Secc, Santiago De Querétaro, Álamos 3a Sección, Querétaro, QuerétaroVer información de la zona","['Superficie total200 m²', 'Superficie construida210 m²', 'Recámaras3', 'Baños3', 'Estacionamientos2', 'Es propiedad en remateSí', 'Antigüedad12 años', 'Ambientes0', 'Bodegas0', 'Cantidad de pisos2', 'Tipo de casaCasa', 'OrientaciónNorte', 'Mantenimiento0 MXN']"
53,Casa En Venta En Álamos 3ª Sección,"2,068,802","Lago De Chapala, Cumbres Del Lago, Querétaro, QuerétaroVer información de la zona","['Superficie total159 m²', 'Superficie construida240 m²', 'Recámaras4', 'Baños3', 'Estacionamientos2', 'Es propiedad en remateSí', 'Antigüedad24 años', 'Ambientes0', 'Bodegas0', 'Cantidad de pisos2', 'Tipo de casaCasa', 'OrientaciónSur', 'Mantenimiento100 MXN']"
54,Casa En Venta Lago De Chapala Cumbres Del Lago Queretaro/ Recuperacion Bancaria. Sh05,"7,500,000","Plaza San Sebastián, Las Plazas, Querétaro, QuerétaroVer información de la zona","['Superficie total269 m²', 'Superficie construida269 m²', 'Recámaras5', 'Baños5', 'Estacionamientos3', 'Es propiedad en remateNo', 'Antigüedad30 años', 'Ambientes8', 'Bodegas0', 'Cantidad de pisos3', 'Tipo de casaCasa', 'OrientaciónSur', 'Mantenimiento0 MXN']"
55,Edificio Remate Bancario Iztacalco Cdmx!!!!,"870,058","Sinaloa 304, San José El Alto, Querétaro, QuerétaroVer información de la zona","['Superficie total180 m²', 'Superficie construida170 m²', 'Recámaras3', 'Baños2', 'Estacionamientos2', 'Es propiedad en remateSí', 'Antigüedad10 años', 'Ambientes1', 'Bodegas1', 'Cantidad de pisos2', 'Tipo de casaCasa', 'OrientaciónPoniente', 'Mantenimiento0 MXN']"
56,Oportunidad De Inversion Inmoviliara En San Jose El Alto Hm,"1,137,000","C. Yaquis 231, Santiago, Querétaro, QuerétaroVer información de la zona","['Superficie total400 m²', 'Superficie construida820 m²', 'Recámaras1', 'Baños4', 'Estacionamientos3', 'Es propiedad en remateSí', 'Antigüedad20 años', 'Bodegas2', 'Cantidad de pisos4']"
57,"Casa En Venta En C. Yaquis 231, Cerrito Colorado, Santiago De Querétaro","3,000,000","Av. De La Cantera 2500, Santiago De Querétaro, Lomas De Satélite, Querétaro, QuerétaroVer información de la zona","['Superficie total400 m²', 'Superficie construida299 m²', 'Recámaras4', 'Baños2', 'Estacionamientos3', 'Es propiedad en remateSí', 'Antigüedad13 años', 'Ambientes4', 'Bodegas1', 'Cantidad de pisos2', 'Tipo de casaCasa', 'OrientaciónPoniente', 'Mantenimiento10 MXN']"
58,"Casa En Venta, Recuperación Bancaria, Col. Lomas De Satelite, Santiago De Queretaro , Queretaro. Jf08","660,000","C. Coros 1 - 300, Candiles, Querétaro, QuerétaroVer información de la zona","['Superficie total107 m²', 'Superficie construida107 m²', 'Recámaras4', 'Baños3', 'Estacionamientos2', 'Es propiedad en remateSí', 'Antigüedad20 años', 'Ambientes10', 'Bodegas1', 'Cantidad de pisos2', 'Tipo de casaCasa', 'OrientaciónNorte']"
